댓글,긍정/부정
우린이는 지우를 좋아하나? 복도에 서 있을때 지금쯤 알때가 됐는데 할때 그거 지우를 두고 얘기한거 같긴 한데 지우가 우린이한테 관심을 가져주기를 원해서 저런 행동을 하는건가? 그저 지우의 관심을 받고 싶어서인지 아니면 좋아하니까 지우가 자기를 바라봤으면 좋겠는지 둘 중 하나 일거 같긴 한데
치직...치...치지직..아아 여긴 7월23일부로 한달뒤 치직..치지직 여기는 서울에 있는 사랑제일 교회로 부터 피해를 입고있다...칙.. 지직..우릴..잊지 마라..
보미진짜예쁘다 매력도 넘치고
차보미...제발...지우랑영원히친한친구되길
이 망할 서브병... 그래도 우린이가 좋아요...
"아아 아아-치지직...여긴 8월 23일 목요일...치직-여긴 태풍 바비가 이동 중이어서 치지지지직...엄청난 피해를 입었다 치지직-치직...또한 서울의 치지직...사망제일교회 모임 치지직-으로 인해 치직...피해를...치지지지직 ...했다 일주일 뒤에 또 상황을 치지지지직- ...할테니 치직- 빠른 보고... 치지지지직 바란다- 치직----------[삐-!시스템 에러,시스템 에러,13829-A 지역과의 통신이 중단되었으며 통신 기기가 고장났습니다,재연락할수 있을 확률 0.0000000001%,확률이 매우 희박합니다.][삐-!마지막 음성을 송신합니다!]...마라[시스템 복구 기능이 작동됩니다!][메세지 0.5% 복원,30.6% 복원,89.9% 복원,99.9% 복원,100% 복원.]별을 삼킨 너에게 놓치지 마라 보미도 존예고 지우도 존예다 안보면 후회한다 우린새퀴 발암이지만 그냥보면 된다 참아라"
그래봐야 초딩인데 질투나서 소꼽친구 좋아하던걸 버리고 딴 여자한테 가네ㅋ
송우린 겁나 실망..... 이래서 송우린이 남주아닌듯.. 송우린 인성 맘에 안들어...
우린이 서브남주 아니었니ㅠㅠㅠㅠㅠ
오늘도 하준하율은 귀엽습니다
역시 넌 아니야
걍 우린이 버려
그래그래 저 송우린 ..? 저 놈 나중에 커서 바람 피고 다닐게 분명해 내 눈엔 보여 ..! 넌 저기 11 살 잘생긴 얘랑 꼭 잘될꺼야 그래그래 .. 뭔가 어릴때 내용도 재밌지만 어른된 버전 중간중간 나왔으면 조켔다 ... 송우린 손절 각 재고 일주일 후에 와야 겠군 ..
"우린아, 어린애....그것도 학대받는 애들 챙겨주는데이건 좀 아니라고 본다........"
"아니, 그럼 자기한테 거짓말 해가면서까지 옆집 꼬마들을 챙기는데, 왜 여주한테 계속 희망을 걸어야하지?그것도 여주가 꼬마들을 챙기는 정도가 스스로의 돈을 터는것도 모자라서 방학 다내주고, 게다가 돈 벌려고 하고, 그래서 자기한테 거짓말까지 하는데, 그런데도 여주한테 일편단심이어야해? 아니 우린이는 무슨 로봇이나 바보니?ㅋㅋㅋㅋ 내 눈엔 우린이가 제일 정상임. 자기 앞가림고 가물가물한 애랑 희망없는 관계 선 긋고,  자기 좋다는 여자애 사귀는게 뭐가 어때서?"
아니ㅋㅋㅋ 사귄 것도 아닌데 사람들 왜 급발진임ㅋㅋㅋㅋㅋ
그래도 학대 당하는 애들한테까지 질투하는건 아니라고 본다 희망없는 관계를끊어내려하는건 이해가 가는데학대당하는 애들한테 처음부터 짜증내고인성 드러내고 이젠 저 어린애들한테 질투까지하는데 여주만 잘못한건 아니지ㅋㅋㅋㅋㅋㅋ
"도대체 우린이 인성이 뭐가 문제라는거? 만화야 여주시점에서 서술되니까 서브남주 역할로 여주 하나만 바라봐야 할 우린이가 다른여자랑 사귀는게 괘씸하다는 것 같은데, 우린이도 자기랑 안맞는 사람한테 계속 매여있어야할 의무는 없지않나요? 여주한테 폭언을한것도아니고 하율이 하준이랑 사이 갈라놓으려고 음모꾸민것도아니고 그냥 여주 행동이 맘에 안드니까 이제 포기하고 자기인생 살겠다는데... 뭐 만화에 나오는 모든 남자들은 연애도 하지말고 여주 하나만 절절하게 바라봐야하나요?ㅋㅋ"
저게 질투인가? 걍 답답하고 자기 말 무시하고 선긋고 하니까 서운해서 저러는거아님? 저걸 질투로 보는게 더 이상한데 베댓들 급발진 오짐ㅋㅋㅋㅋㅋ
대댓글에서부터  대부분이 연령층이 낮은게 바로 보이네요...사귀지도 않았고 어딜봐서 질투인거죠? 황당하네요.
와 칼업뎃 베이겠어여 작가님...
베댓 수준 왜 이럼...? 우린이는 여주 심하게 다친 것도 그렇고 걱정 많이 했는데 여주는 자기 몸 안 챙기고 애들먼저 챙기는 거 보면 마음 접을 수도 있는거지;;;; 베댓 보고 놀랐네 진짜
아니 누가봐도 질투 아니잖아ㅋㅋㅋㅋㅋㅋ 베댓 말대로 우린이가 제일 정상이구만ㅋㄹㄹㅋㅋㄹㅋㄹ
연령대 낮긴 한가봄... 송우린이 뭘잘못한거지 여주시점이니까 그런거지 ㅋㅋㅋㅋ 그냥 자기랑 안맞으니까 다른아랑 사귀는건데 사귄게 쓰레기란 소리까지 들어야하나
"연락 안 받는데 개학까지 찾아가 보지도 않다가 겨우 쿠키 구워서 기분 풀리겠지. 이러는데서 지우가 우린이를 어떻게 생각하는지 나오지 않아? 우린이가 다른 애랑 사귀는거에서 쿠키 떨굴만큼 둘의 사이가 친구 이상으로는 안 보인다... 미안한걸 떠나서 뒤늦게라도 보고 싶어서 찾아가는 성의가 있어야하는데... 같이 여행계획 까지 세워놓고서 불쌍하다고 추억 쌓니 뭐니 하면서 애들이랑 놀러 다니는 거 보면 퍽도 마음이 안 변하겠다. 집도 잘 살고 방학때 마다 해외가고, 같이 파티하는 애들 수준도 있을텐데... 지우가 공부할 시기에 뉴튜브 한다는 건 우린이 눈엔 우습겠지"
나만 떨어져서 부숴진 쿠키가 더아깝다고 생각하는건가?
하연이가 잘못했네. 마스크도 안쓰고 ㅡㅡ 사회적 거리두기 몰라?
우준 3명 더 있는 느낌..
애들 다 왜이럼⸌◦̈⃝⸍ˀ̣ˀ̣ˀ̣ 당황스럽네... 나의 착하고 귀여운 민욱이는 어디가고 능글맞은 애가 왔어;;;;;;;
난 이것도 걱정인게 만약 민욱이가 부자인게 아니라 힘든 형편에 적금 들어놓고 꼬박꼬박 모은걸 빙의댄 애가 쪽쪽 뽑아 쓰는 거면 어떡하나 하는 생각도 듬
아니....민욱이뿐만 아니라 다들 빙의된거야....?
근데 저 민욱이는 찐민욱이가 아닐듯함. 민욱이 성격은 따뜻하고 배려심 많은  스타일인데 지금은 너무 다름. 아마 우주(혹은 무의식)에서 민욱이에게 들어온것 같고 이걸 해결해나가는 과정에서 어떻게 우준이 들어가게 됐는지 나오지 않을까? 하연이가 찐친구라도 믿고 있었던 애들이 다 돌아버린거 같은데 하연이 어떻게 버텨나가려나 궁금해지네
귀신 씌인것처럼 왜 그런대요
민욱이 흑화됐네... 섹시하다...
민욱이 돌려줘ㅜㅜㅜㅜㅠ
이렇게 하연이 주변에는 아무도 안 남는건가요? 그건 너무 슬픈데.. 정들었던 친구들아 다 어디간거니...
그동안은 외계인이라는 특성상 가진성이 다음으로 쎄한게  우준이었는데.. 지금은 우준이를 만나야 안심이 될 것 같네
뭐야 로맨스 아니었어? 개무섭네 수바
아..진짜 본래 애들은 어디로간겨..불쌍해..
민욱이 안에 진성인듯... ㅜㅜ 민욱아 돌아와
"현수가 마음 속에 숨어 있다는거나 우준이 심리에 관한 서적을 읽은거, 교수님의 강의에서 추론해보면 인간 무의식과 우주가 연결고리인거 같다. 즉 어떤 사람의 자아가 무의식의 영역으로 탈출하면  빈 공간이 생기는데, 그때에 우주인이 들어오는거 아닐까? 처음 우준이 술 마셨을 때의 반응과 최근화의 반응을 보면 꽤 가능성있다고 봄. 그렇다면 대충 우준의 욕망과 현수의 욕망이 맞아떨어졌고 그건 우준은 하연을 보고 인간을 경험하고 싶은거 현수는 도피의 심정이 크지 않았을까 함.그런데 현수는 자기 마음에 있다고 했으니 우주에 있는 애들은 형체가 따로 없을수도 있다고 생각. 진성이에게 이름 붙여주자 좋아하는 거나 인간의 인간관계와는 다르다는거, 그리고 죽을 때도 좀 다르다는거 보면 그러지 않을까 싶음.. 그래서 우주가 과연 우리가 생각하는 그 우주가 맞는가 생각도 듬. 미분화되며 정제되지 않은 감정과 욕구가 있는 곳이 아닐까 싶기도. 그래서 무의식과 연결되기도 하는거고 흠"
민욱이의 큰 그림같음. 민욱이 몸에 진성이가 들어간게 맞고 친구 두명의 몸에는 진성이 외계친구들이 들어간듯. 그 둘이 하연이를 적대시하게 한후 하연이가 자신을 의지하게 만들려는 듯. 마침 우준이도 없고.
아.. 지금까지 잘 참고 봐왔는데 해도해도 너무한 것 같아 처음 댓 남겨요 ㅠㅠㅠㅠ 여주 너무너무너무 답답한 성격.... 지금 70년대 인가요... 아니면 작가님이 혹시 8-90년대 순정만화 시대를 버리지 못하는연령대의 분이신건가요.. 캐릭터에 매력을 불어넣어주세요 ㅠㅠㅠㅠㅠ 아무리 내성적인 성격이어도 저렇게까지 자기주관 없고 수동적인캐릭터는 현실적이지 못할뿐더러 심지어 픽션에서는 그 어떤 매력과 생동감도 느낄 수 없어 많은 독자들은 캐릭터에 공감하지 못하고 웹툰자체에 몰입도를 떨어뜨립니다ㅠㅠ 작화랑 커다란 줄기가 되는 스토리가 흥미로워 지금까지 보고는 있는데 이제는 보다보면 다음 화가 궁금하다거나 여운이 남는 게 아니라 그냥 '여주 오늘도 답답했다' 이 감상만 남아요ㅠ
"근데 저 친구들은 왜 마스크를 쓰고있지...? 저 세계도 코로나 도는 건 아닐테고,,,"
민욱이 집 진짜 부자인거 맞지??? 외계인새끼가 민욱이 돈 펑펑 쓰는걸까봐 걱정되는 1인...
우주인들 단체로 지구에 놀러온건가;;민욱이 돌려내ㅠㅠㅠㅠ 
켁켁 이러는데 저상황을 그냥 넘기는 건 여주가 좀 멍청한가...?
뭐야뭐야 의심스러워 민욱이 아니고 그 우준친구일거 같아 지구정복 시작이야? 뭐야뭐야?!
진성이가 민욱이 몸에 들어간것같음 ㄹㅇ
아 잘생겨서 좋은데 느낌이 달라짐....민욱이 아니고 우준친구일듯그나저나 다른 친구들은 어떻게 된거야😢
급 스릴러물 시작인데? ㅠㅠㅠ 개무서워 다들 외계인인거아냐
엄청 수상하게 켁켁 거리고는 톡 확인조차 안하는데 단순 목감기겠지 하고 넘길 수가 있나;;
소름... 주희 왜 보여주나 했더니 떡밥이었네우준한테 핵까여서 거의 학교 전체 이미지 말아먹었는데학교 근처 돌아다닐때 이상했었음즠 주희도 지금 빙의 됐다는 소리잖어
이렇게까지 전개가 예상 안 되는 웹툰 오랜만이다...
친구들 다 학교 못나온것도 우준 친구가 하연이 주변 친구들 중 한명의 몸에 들어가기 위해 다 한번씩 시도해본거 아닐까... 그래서 은영이한테 컥컥 숨막히는 소리가 들렸던거고...
민욱이 아니고 진성인거 같은데 와중에 왜케 잘생겼냐....분위기 쩔어.....
난 진짜 민욱이라고 믿는다..민욱이파 존버...
민욱이 머리 길고 눈빛이 달라진게 진성이가 민욱이 몸을 장악해서 무서운 일을 꾸미는거 같아여...슬프다ㅜ착한 민욱이 돌리도너무 궁금해흑 진도좀 슉슉 나갔으면ㅜㅜ
아니 민욱이랑 하연이 인간대인간으로 이어져야 한다구요ㅠㅠ 찐 제목 나의 민욱 아니냐구요ㅠㅠ
헐 뭐야 민욱이 맞아?
이제 진짜 본격적인 스토리가 진행될듯
갑자기 장르가 달달에서 호달달로 바껴버렷네;
아 진짜 몇몇 화마다 여주 바보끼 보이는 거 넘 당황스러움.... 연락처도 없고 대화도 안 하던 여자애가 여친이라고 나타남ㅅ을 때도 음 번호 바꿔서 그랬나보다~ 이러고 넘기고 자기도 소리 듣고 놀라놓고 감기라니까 수긍하고...ㅋㅋㅋ 미치겠네
하연이 너무 생각이없다..일부러 전개 위해서 필요한 설정이지만 너무 개연성없고 억지스러운느낌...
장하연 존나 매력없고 개답답한 캐릭터임. 머리속이 꽃밭인건지 ㅅㅂ 존나 머리 한대 따려주고싶음
이번편 ㄹㅇ 가장 무서웠음..;; 연관 인물 3명 갑자기 없어져버리고..은영이? 켁켁대는건 숨쉬기 힘든 상황이라는거 아님? 엄마도 진짜 엄마 아닌거같애..ㅠㅠ 진짜 말 그대로 로맨스릴러..
주희는 왜 따라가는거지.. 이해 불가..
"이번 화 민욱파 억장 와르르 ,,"
우준은 언제 떠날지 모르는 외계인이고 현수 껍데기인데.... 민욱이 잡아달라
작가님 민욱이를 갑자기 남주로 바꾸셔도 좋습니다 1/10000000000000
현수파가 있긴 한가요?... 독자들은 정말 만장일치 민욱파 같은데ㅠ
민욱이 서브를 반대한다!반대!반대! 너무 아깝다!!!반대한다!반대
민욱아ㅜㅠ 이미 민욱이는 포기하고 있었던듯 ㅠ
아니 하연아 너가 주희는 왜따라가 그리고 우준 언제 떠날지도 모르고 남의 겉모습 빌려쓰고 있는건데 대체 어느부분에서 사랑에 빠진건지 전혀 모르겠다... 
한화마다 내용전개가 겁나 느리고 알맹이가 없음....솔직히 쿠키구우며 보지만 등산하는 것만 3화가 넘고 내용 너무 부진해요
보면 볼수록 내용은 감을 1도 못잡겠고 약간 지루해지네요....😭
"자존감 낮던 하연이가 민욱이가 아닌 우준을 택하는 이유는 세상을 살아오며 본인을 모른체 무시하던 사람들 주위에서 혼자임을 느끼던 하연이가 우준과 함께 대화를 나눌 때에는 누구에게도 말하지 못할 본연의 모습, 진실된 감정을 나누어 왔기 때문 아닐까 생각합니다. 그리고 여태 친구도 없었고 가족과도 그리 가깝게 지내지 못했던 것 같은 모습을 미루어 보았을 때 이정도 흐름의 하연 감정선은 충분히 이해가 됩니다만.."
미.민욱청년.... 할미가....만이 사랑햇혀....홀홀.... ... 김민우이~ 니가..내 @@q..ㅂ별이다...!!!@!!!!!@!@!@!!!
억장이무너진다
헐 진짜 57화동안 내용이 하연이 친구생기고 주희랑 스토커 ㅈ된거밖에 없음... 민욱이 마저 까버리고...전 탈주하렵니다
이제 쿠키는 없다.. 민욱 돌려내
왜 비까지 맞아가면서 쫓아간거지...? 되게 친한 친구사이인 줄
아니 독자들 어림??민욱이 한번 안받아줬다고 이웹툰 않본다고하고 별테를하냐;;제발 느그들 맘대로 안 흘러간다고 트집좀 잡지마..스토리는 작가가 생각하는거임 민욱이 차였다고 빼액 좀 하지말라고;;
여기서 애정도 차이가나는게 보인다 현수는 연락안되니까 개 지ㅡ롤 발광을 떨더니 민욱이 없어지니까 내일 물어보지 뭐~ 여기서 이미 답 나왔다 봄 ㅋㅋ
저 우준파인데 ... 진짜 민욱파들밖에 없나요 ..??
민욱이 차이자마자 스토리가 부진하다느니 알맹이가없다느니...ㅋㅋ 걍 민욱이 차인게 맘에 안든다고해 굳으 트집잡지말고
민욱아........난 네편이야...ㅠㅠ
제발 우리 민욱이 행복하게 해주세요ㅠㅠㅠ
민욱이 초반에 왤케 멍뭉이 같애... 주인이 딴 멍뭉이 안아주고 있어서 질투하는 것 같네
"우준의 ""정말로 그러진 않았어"" 이 말이 진실인지 너무 궁금"
잠만 민욱이 안에 딴 우주인? 들어와 있을지 나만 불안해...?
민욱일 서브남주로 남기지마세요. 제발..
민욱아....어휴 찌통진짜 ㅠㅠㅠㅠㅠㅠㅜ헌신이란 헌신은 있는대로 다하고 장기기증 마냥 온몸 바쳐 좋아하고 티내면 뭐해 현수가 펜타킬 마무리하는데 ㅠㅠㅠㅠ 어떤 결말이 나도 찐남주는 민욱이야 ㅠㅜ
제발제발... 민욱루트로 가주세요...... 
우준 술 안마실려는 이유가 의식 날라가면 내면 현수 진짜로 튀어나올까봐 그러는건가
"우준이나 진성이 정체는 무의식 자체가 아닐까라는 생각이 드네요 태어났을 때 우리는 아무런 규범이 없이 태어나기 때문에 본능에 충실하게 살지만 점차 자라면서 사회가 정한 규칙으로부터 직접 영향을 받기 때문에 할 수 있는 것과 없는 것 즉, 의식을 가지고 본능을 억누른다고 하잖아요 작품 초반에 우준이가 무슨 말을 하든 계속 물어보는게 언어가 달라서가 아니라 아무것도 정의가 내려지 않는 날 것의 상태라서 그것을 정의하기위해 물어보는 것 같고 배우고 습득하고 익숙해지는 것도 약간 우리가 성장하는 모습과 비슷한 것 같다는 생각이 드네요 또 무의식에 잠식되면 의식이 지배하는 평소와 달리 힘이 몇십배 쎄다고 들었는데 전 화에서 밧줄을 한번에 끊어내는 모습을 보니  (현수가 원래 힘이 쎌 수 있겠으나 아무튼)  진성이나 우준이는 무의식의 존재라고 생각이 드네요~ 그럼 몸을 달라는 이유가 자기들은 항상 억누르고 있어야할 존재라 불만인가?"
야 그때 진상이냐 진성이냐 그 우준 친구인척 한 우주인 들어온거 아니지? 제발 아니길 빈다 제발
우준아 미안한데 우주로 잠시만 가줘라 민욱이랑 하연이 잘되면 다시 와주라 민욱이절대존버해ㅜ
단체로 서브병 걸린 만화네ㅋㅋ물론 나도
뒷모습.. 달려가서 안기고 싶네 
근데 솔직히 우준 현수 몸에 들간거 아니면 하연이도 안좋아했을듯
예전부터 느낀 건데 여기는 만화에 대한 관심은 없고 누구랑 이어지냐에만 혈안이 되있는 것 같음 누구랑 이어지든 하연이의 마음과 그 마음을 생겨나는 과정에 우리가 집중해야 하는 거 아닌가?누구를 더 좋아할 수는 있어도 빼액 거리면서 무조건 ㅇㅇ!! ㅇㅇ!!하는 게 좋게 보이지는 않음 제일 이해 안 되는 건 외모에 대한 것. 어차피 겉 껍데기가 호감을 가지고 있던 사람이 아니었으면 안 좋아했을 것 아니냐 이러는데 하연이가 현수에게 호감을 가지고 있는 이유는 겉 껍데기 때문만이 아니라 평소 아주 어렸을 때부터 교감해왔던 어떠한 존재와 최근에 호감이 생기기 시작했던 사람의 외모가 결합 되어서 나타난 거임 무조건 외모 때문만이 아니라는 거지 그리고 현수가 잘생기지 않았으면 호감이 안 가지 않았겠냐라는 말도 많은데 그건 민욱이도 마찬가지 아니냐? 그리고 하연이 성격 자체가 사람 겉 모습만 보고 판단하고 좋아할 얘도 아님.. 결론은 그냥 만화 스토리에 집중합시다 누구랑 이어지든 일단 지켜보자고요
다리 뽀개고 온거면 ㄹㅇ 호러물인데
하연아 솔직히 우준이 현수 몸에 빙의해서 그렇지 영식선배 몸에 빙의했으면 마음이 갔겠냐 우리 가슴에 손을 얹고 생각해보자
하연이도 자기 마음을 깨닫게 된걸까용... 난 사실 민욱파인데...
와 저러다가 민욱이 저 장면보고 하연이는 우준을 좋아하구나하고 맘접는 거 아니겠지..... 민욱아..
근데 현수도 진짜 어지간히 스트레스 받았겠다 ;;
와 현수 벌써 스토커 다리 뽀개고 온거?
우준아 다리 뽀사버렸니...?
우준 진짜 초인적인 힘이 있긴 하구나.. 우리의 민욱은 서브길로 떠나는건가ㅜㅜ
민욱이 볼 수있으니까 일단 떨어져봐 제발 ㅜㅜㅜㅜㅜㅡㅜㅜㅜㅜㅜㅜㅜㅡㅜㅜㅜㅜㅜㅡㅜㅜㅜㅜㅡㅜㅜㅜㅜㅜㅜㅜㅡㅜㅜㅜ
이건 베댓 인정이다..진짜로 영식선배 몸에 우준이 들어갔으면 맘이 갔겠냐..초장 1~2화때부터 이미 하연이는 현수를 눈으로 쫓고 있었고 현수보고 얼굴 붉혔었는데..
민욱이는?.... ... 우리 민욱이... ....
하영아... 가슴에 손을 얹고 생각해봐... 우준이 빙의한 인간이 이현수가 아니였다면 호감 안느꼈을 거잖아.
솔직히 베댓 ㅇㅈ 난 옛날부터 하연이가 우준 좋아한다고 말했을 때부터 하연이는 이현수를 좋아하는 거지 우준을 좋아하는 게 아니라고 생각햇늠
민욱파들 다 우는중ㅜㅜㅜㅜㅡㅜㅜㅠㅜ
왜 다들 겉모습 얘기만 하지.... 하연이가 이성을 볼 때 외모만으로 좋아할 스타일인가요? 우준은 항상 자기 곁에 있어줬고 좋은 말도 많이 해줬으니까 좋아한 거겠죠... 그럼 그 논리대로  반대로 물어보면.. 민욱이 외모가 영식선배 였다면 하연이가 설레했을까요? 이건 민욱이한테도 해당되는 말이에요.. 
우준은 얼굴도 없었잖아 난 이거 외모로 따질 문제가 아니라고 생각하는데 20년 동안 둘만의 공간에서 자기 얘기를 해 왔고 그걸 다 들어 준 애가 우준인데 과연 정이 없을까 단순한 애틋한 마음을 넘어서 충분히 사랑으로 갈 수 있어요 그리고 우준도 하연이한테만 잘해요 여러분 민욱이만 보셔서 놓치고 계신 거지 이번 화에서도 봤듯이 자기가 다치면 걱정하는 사람이 있다면서 자기 몸을 지키잖아요 하연이 마음을 우리가 뭐라 단정 짓지 맙시다 그리고 아직 고백도 안 했어요 진정해요 ;;
다 비교대상이 영식인거 개웃기네 ㅋㅋㅋㅌㅌㅋㅋㅌ
우준이 왜 얼굴 빼면 시체야 하연이한테 몸이 없을 때도 힘이 되어준 존재인데
막베댓 좀 말이 그런게 민욱은 원래 자기가 그렇게 생긴거고 우준은 자기가 그렇게 생긴게 아닌 다른 사람 외모니까 그런거지
막배댓님 말이 안 되는게 초반에 하연이가 우준 말고 찐 이현수 좋아했었는데 알고보니까 성격 진짜 뭣같았잖음 그게 얼굴보고 좋아한게 아니면 뭐지
응 너도 그랬어
누가 저 기절 좀 시켜주세요 나중에 고구마 풀리면 깨워주구
지가 뭔데 저기서 성질?
이거 완결될때 깨워주세요 답답해 죽을거 같아...
아니 이정도면 강지우 인격이 두개인데 숨어있던 인격이 올린거 아니냐구...근데 쟤는 뭔데 상관해 애초에 지가 그 여배우한테 안겨서 온건 뭔데!
경험해봐라 목격했을때 아픔을
낄낄낄낄낄 좋아 남편이여!!!!!!!! 보면서 질투나 하거라 ㄲ니ㅣ히히히
"""앞뒤 사정을 어떻게 알겠어요.""오해였다는 걸 나타내는 말이라고 생각함ㅋㅋ아 근데 둘이 얘기를 안하잖아 얘기를 진짜 소주까면서 걍 말하라고 오해라고!!!!서로 미안하다고 사과하라고!!!"
나만 고구마 먹은게 아니구나...(안심)(위안)
사실이 아닙니다 샬라샬라 기자님이 맘대로 내보낸거에요 샬라샤라
이웹툰재밌네
여기서 끊어?
샬라샬라 샬라샬라 중독성 쩌네ㅋㅋㅋ
"여기까지 지른 사람,, 그게바로 나,,"
근데 섬네일미쳐서 안들어올 수가 없게만드네!!...
남의 불륜이런 거 너무 좋아 아줌마들 아침드라마 왜 보는지 알 갓 같음
근데 보통 싫어하는사람한테 실수로 안기게되면 두근이 아니라 불쾌아닌가?
나만 저 남편이랑 안 이어졌음 좋겠나??
베댓뭐야 샬라샬랴
아...작가님..끊는거 넘행 ㅠㅠ
다음편  기브미..
저거저거 사진찍은 사람이 심혜영 매니저면 부모님 앞에서 트월킹을 추겠습니다
트월킹추는 사람 옆에서 비보이 하겠습니다
트월킹 비보이 옆에서 팝핀 하겠습니다
그분이 맞으면 트월킹 영상 보여주시는건가요? 
비보이추는 사람 옆에서 반주를 하겠습니다
트월킹추는사람 옆에서 잘못된만남 2키 올려 부르겠습니다
트월킹 비보이 팝핀 옆에서 깡 추겠습니다
잘못된 만남 2키 다시 내리겠습니다
베댓들 맞으면 다 인증하세요
베댓들 죽이 척척맞네 ㅋㅋㅋㅋㅋㅋㅋㅋㅋ 
깡 추는 사람 옆에서 헤드뱅잉 하겠습니다
베댓들 그러면 부모님한테 단체로 가는건가요
아니 베댓들 ㅈㄴ 웃기넼ㅋㅋㅋㅋㅋㅋ
근데 진짜 부모님 앞에 사람 끌고와서 트월킹 추고 노래 부르면 쫓겨나지 않을까....🌸
헤드뱅잉하는 사람 옆에서 뱅뱅뱅 추겠습니다
그럼 저는 뱅뱅뱅 추는 분 옆에서 WAP댄스 추겠습니다
이 모든 사람들 옆에서 마스크를 나눠주고 있겠습니다
"배댓들 맞으면 유튜브에 올려라 ㅋㅋ 유튜브 제목 ""웹툰 배댓 공약 실현 트월킹"" "
뱅뱅뱅 옆에서 보고싶어 4키 업 합니다
뱅뱅뱅 추는 사람 옆에서 레릿비 부르겠습니다
아무리 생각해도 여주 남주 둘 다 이해가 안감 특히 남주 어따대고 큰소리야 일단 지가 관리못하고 술처마시고 여자랑 외박한게 잘못이지
뭘 성공을위해 남편을 팔아넘겨 ㅋㅋ 지가 다른여자랑 같이있었던건 생각안하고
