댓글,긍정/부정
아저씨가 말하는 말풍선이 잘못된것같네욤 해수가 말하는걸로 수정해야 할것같아요
해수와 연경이 수아한테 한 잘못으로 욕을 먹을 때마다 저 둘이 저럴 수 밖에 없었던 일이 분명히 있었을 거라고 생각했어요 하필 선역에 서서 같은 조선인에게 냉혹했던 두 사람이라 욕도 많이 먹었지만 해수 서사까지 다 풀린 지금 저는 해수와 연경에게 자꾸 마음이 가네요 그 시절을 살아보진 못했지만 뼈아프게 느껴지는 묘사에 가슴이 너무 저려서 눈물이 자꾸 납니다 어린 아이가 자결을 택할 만큼 추악한 선택권을 주고 끝내 여러 사람을 바닥까지 끌어내린 일본의 잔인함에 치가 떨려요 지키고 싶었던 것들이 하나둘 스러져가는 상황에서 해수에게 수아가 버팀목이 돼줬으면 좋겠습니다 가족을 잃은 해수 그리고 아가씨를 잃은 수아 비슷한 아픔을 지닌 두 사람이라 비록 시작은 엇나갔지만 한치 앞도 예상할 수 없는 어둠 속에서 서로에게 빛이 돼주기를 간절히 바라요 치열하게 살아온 만큼 부디 바라고 바라던 광복까지 볼 수 있길... 제발 끝까지 살아줘 얘들아ㅠㅠ
"예전에 해수가 수아 약먹이기 전에 나한테는 어떤 사연이 있을 거 같냐고 했을 때가 떠오르네요.. 해수한테는 저 모든 기억이 죽을 때까지 따라다니겠죠. 특히 냉정해져야 될때면 더욱 저 때의 고통을 떠올리며 마음을 벼릴 수밖에 없을 듯ㅠㅠㅠ자기를 용서하지 않았음에도 따듯한 손을 내민 수아와 앞으로 관계가 어떻게 변할지, 서로를 어떻게 이해할 지 매우 궁금해집니다! "
해수 진짜 너무 마음아프다...저때만해도 분위기가 정말 따뜻하다 말투도 그렇고..너무 어린 나이에 가장 역할을 해야했고 이제 주변엔 책임져야 할 사람들만 남았으니 부담감이 정말 어마어마 했을텐데 자기는 무너지면 안되니까 이악물고 버틴거 같아...책임져야할 해영이도 녹주도 그렇게 가버리니까 해수 마음은 어떨지 정말..그 와중에도 남아있는 사람들은 지켜야 하니까 상황파악 하고 대처하는 것까지 얼마나 많이 무너져내렸겠냐고...
참변에서 구사일생으로 살아남은 어린 동생 입에서 죽여달라는 말이 나왔을 때 해수의 심정은... 정말... 다른 어떤 일보다 저 말이 더 한이 될 듯
"그런말이 있죠..너무 단단해도 부서지기 쉽다고..겪어온 걸 생각하면 충분히 이해가지만사람들에게, 인간대인간의 관계에서 아예 문을 닫아버린것 같아 안타까워요..분명 해수 마음을 다시 열게하는건 수아일거에요..서브남주로서의 결말이 뻔히 보이긴 하지만..ㅜ"
아.. 일본어 대강 읽으니까 엄마가 해영이와 일면식도 없는 사이라고 말하니 그걸 증명해보이라고 엄마를 칼로 직접 찌르라고 했네... 해영이 트라우마 어떡하니...
"내일이 광복절이네요. 정말 잊어서도 안되고 있어서도 안되는 날이지요. 사실 부끄러운말이지만 광복절,삼일절에만 독립운동가 분들과 그시절의 아픔을 느꼈어요. 하지만 이 고래별 작품을 통해 매주마다 일제강점기 때의 아픔을 되새기게 되는것같아요. 보면서 분노를 일으키고 때로는 가슴이 먹먹해지게 하네요. 제게는 정말 의미있고 인상깊은 웹툰인것같아요. 작가님 훌륭한 작품 만들어 주셔서 감사합니다! 자신의 목숨을 바치시면서 나라를 지키신 독립운동가님들도 감사합니다. 오늘날 우리에게 대한민국을 주셔서 감사합니다."
"송창준의 둘째 아들인가? 이녀석도 데려가라.눈 앞에서 아들이 또 죽는 것을 보고 싶지 않다면 저 여자도 입을 열겠지....지금 이 여자가 뭐라고 했지?...처리해.기다려.처음 보는 녀석이라고?그렇다고 합니다.일면식도 없는 사이라면 간단하겠지.일면식도 없는 사이라면 간단하겠지. 증명해 봐.여기, (모자이크가 심해서 읽기 힘들어요.)(모자이크가 심해서 읽기 힘들어요.) -해봐.송창준을 잡았답니다! 마을 외곽에서 발견한 모양입니다!모두 이동하라.여기는 몽땅 태워버려."
해영이한테 엄마찌르게한건 아니겠지?
해영이한테 엄마 찌르라고 했을듯..
전중이 일곱이 진흙색 일복 입고두 무릎 꿇고 앉아 하느님께 기도할 때접시 두 개 콩밥덩이 창문열고 던져줄 때피눈물로 기도했네 피눈물로 기도했네대한이 살았다 대한이 살았다산천이 동하고 바다가 끓는다에헤이 데헤이 에헤이 데헤이대한이 살았다 대한이 살았다&lt;낭송&gt;전중이 일곱이 진흙색 일복 입고두 무릎 꿇고 앉아 하느님께 기도할 때접시 두 개 콩밥덩이 창문열고 던져줄 때피눈물로 기도했네 피눈물로 기도했네대한이 살았다 대한이 살았다
해영이 어떡해.. 쪼그려앉아있는거 보니까 마음 찢어진다.. 진짜 역겹다 저런거 시키는게 사람새키냐..
해영아... ㅠㅠ 해수가 꿈? 꾸던 장면이 정주행하다 보니 있던데... 거기서 '내가 죽인 거지?'라는 대사가 있길래 해수가 주변인을 죽인 적이 있던 걸까 했는데... 어린 해영이에게 시킨 일인가 보군요 ㅠㅠ 어제 단행본 받은 기념으로 정주행하다 울었는데 이번 편도 정말 ㅠㅠㅠ 고래별 사람들 다 행복했으면 좋겠어요 ㅠㅠㅠ
전에 녹주가 해영이 오빠도 있었다고 과거형으로 말한거보면 트라우마를 이길 수 없었나보네요..
설마 해영이 죄책감 때문에 나중에 자결한 건가요?ㅠㅠ
해수 처음에 수아 죽이려고 할때는 마냥 나쁘게 보였는데 자면서 엄마랑 동생 부르는거 보니까 마음 아프다ㅠㅠ 살기 위해서 강해진거였음
헐 썸네일 바뀐 거 너무 예뻐요 ㅠㅜㅜㅜㅠ
그럼 해영이는 어떻게 된건데 지금은?ㅠ
해영이 살아서 다행이다 ㅠㅠ 죽을까봐 일주일동안 걱정했어
일본어 해독해주실 능력자분 올 때까지 존버ㅠ
이제야 이해가 가네요 해수가 관동대지진을 겪은 의현의 트라우마를 언급했던 일이 ... 의현에게 그때의 분노가 자신을 앞으로 나아가게 해줄 것이라고... 모두가 이 시대의 피해자 이지만 해수는 수아에게 욕을 먹을순 있지만 절대 우리가 비난 할수 없는 인물인 것 같네요
와 작가님 너무 대단하시다.. 일본어 해석 없이 적어놔서 알아들을 수 없는 인물의 답답함을 독자도 같이 느끼게 함..
와 일부러 일본어를 해석하지 않아서 더 이 상황에 몰입이 되게 만드네... 진짜 대단하시다
해영이 입장에선 살아도 산 게 아니네요...
일본어 해석 일부러 안 적어주신 거 너무 좋다 저 억울한 상황에서 같이 못 알아들으니까 참담한 기분이 더 무섭게 다가옴
본인은 칼에 찔려서 아무것도 못하고 눈앞에서 가족들 몰살당하는걸 지켜볼 수밖에 없었던 해수 심정이 어땠을지.. 심지어 아직 어린애였는데 겨우 탈출해서 경성으로 내려오는 동안 안 미친게 다행일 정도. 당시에 저런 비극을 겪은 해수 같은 사람이 한둘이 아니었다는걸 생각하면 일본에 이가 갈림
피가 끓는다는 게 이런 감정이구나.......진짜 그림으로 보는데도 원통하고 서러워 죽겠다 저 시대를 살아간 우리 조상들은 얼마나 뼈에 사무치게 괴로웠을까..
총에 맞아도 반나절 이상을 버틸 수 있었던 게 정신력 뿐만이 아니라 익숙해서이기도 한가보네 미친다 진짜 해수야 널 어쩌면 좋니ㅠㅠ
해수가 냉정해질만 했네... 눈앞에서 가족을 다 잃었으니
이렇게 보니 녹주의 죽음도 너무 슬프네요.. 이 괴로운 시간 겨우 이겨내고 고래별로 가서도 잘 지냈는데.. 결국 죽고... 너무 안쓰러워오
아니 이게 뭐야.. 대체 뭐가 지나간 거야..
앞으로 나한테 잔혹하다는 고래별 60화 일본이다.....
번역안된 일본어송창준! 송창준 집이 여기인가?&lt;집에 쳐들어오는 장면&gt;시끄러운 암컷이다. 송창준의 아내인가. 빨리 데려가! &lt;어머니가 일본군에게 소리친 후&gt;집안을 구석구석까지 찾아봐 송창준도 확실히 가까이에 있을 것이다. 그게 무슨 일이야? 뭐야?&lt;해수가 공격당한 후&gt;뭔데? 송..창준의 친족인가&lt;해영이 잡혔을때&gt;
"해수가 1904년생이라 했으니 1920년이면 한국나이로 17살, 현재면 고등학교 1학년이네요...눈물난다 진짜ㅠㅠㅠㅠ"
역시 처음이라 쏘는 걸 망설인 건가? 망설여서 어머니 동생 뫃치고.. 그래서 이후부터는 망설이지 않고 쏠 수 있게 됐다거나............ .. 작가님 저 울어요
26화에나오는 해수의 어깨상처가 이때생긴거구나
기쁜 내용인 작가의 말과 그렇지 못한 본편 내용
"가족들이 눈앞에서 총살...눈을 감아도 그 참극이 보일 텐데, 독립 이외에 다른 뭔가를 볼 수 없겠죠. 이미 가족들 시체로 시야가 차 있을 테니까ㅠㅜㅠㅜㅠㅜ아 몰라 작가님 저한테 왜이러세요ㅠㅜㅠㅜ"
단행본 소식은 기쁘지만......
"그래서 해수가 수아한테 그렇게 냉정했던 거구나...자신의 아주 잠깐의 망설임으로 인해 자신도 죽을 뻔했고, 가족들이 눈앞에서 몰살당하는 걸 봤으니까 아주 작고 사소한 것이라도 혹시 고래별 식구들이 위험해질 만한 요소를 남겨두기 싫었던 거겠지...해수가 수아한테 한 짓은 진짜 잘못한 거지만...해수가 그렇게 될 수 밖에 없었던 이유가...너무 참혹해서 그냥 마음이 아프다."
제가 해수라도 총을 쏘길 망설이는 의현에게 쓴소리했을거같네요 자기가 물렀던 탓에 덕에 가족을 잃었다고 생각할테니...얼마나 길고 괴로운 자책이었을까요. 수아한테 그렇게 해야만했던것도 이제 이해는 가네요 모두 역사의 피해자입니다 
"이 웹툰 진짜 모두가 봤으면 좋겠어요... 둘러보다가 제목이 예뻐서 정주행했는데 진짜 너무 명작이에요 로맨스나 판타지가 아닌 실화를, 그것도 우리 민족의 뼈아픈 역사를 바탕으로 제작되었다 보니까 공감도 많이 가고요 앞부분에서는 해수와 연경이 밉기도 했는데 저마다 고통이 있고 관점이 있으니까요.. 그들이 수아에게 왜 그런 짓을 했고 의현을 이해하지 못하는 이유가 한 화 한 화 볼 수록 너무 잘나타나는 거 같아서 좋아요 작가님이 역사에 박식하고 얼마나 조사를 많이 하셨는지도 티나는 거 같네요 너무 마음이 아파요... 사랑하는 사람이 눈앞에서 죽어가고, 진정한 사랑을 하지 못한 채 누군가에게 조종당했던 삶을 살았던 우리의 조상들이 얼마나 아팠을지 감히 가늠조차 할 수 없습니다 너무 재밌고 이 웹툰은 웹툰 시나리오를 또 조정하지 않는다 가정하면 드라마나 영화로 제작되어도 손색없을 정도로 너무나 훌륭한 작품인 거 같아요 고래별을 보게 돼서 다행이에요ㅠㅠ 진짜 너무재밌음"
아직도 해수 욕하는 사람들 많은데 물론 수아 입장에선 죽일놈이고 수아가 대인밴건 맞지만 우리가 욕할순 없음. 솔직히 해수에게 고래별은 독립운동 그 이상의 의미인데 수아를 (수아는 당시 친일파 하인 이었음) 살려서 고래별 사람들이 위험해 진다면 안돼니까 죽이려고 한거임. 수아는 살아난게 너무 다행일뿐. 또 이미 해수는 행동으로 보여준게 많기 때문에 해수 욕할수 있는건 수아뿐임.
고래별은 우리가 마주하고 싶지 않지만 마주해야만 하는 역사 자체인것 같아요 이번화는 가슴 미어지네요 근데 다음화도 너무 슬플것 같은 예감이 ㅠㅠㅠ  작가님 단행본 내주셔서 감사해요 고래별은 진심 전 국민 필독서 아닌가요 내 아들이랑 같이 볼거얌 힝ㅜㅜㅠㅠ
여전히 계속 일본 불매중임..ㅜㅜ
물비린내 나는 공기를 마시면서 오늘 화를 보네요. 장마 때문에 짜증나고 예민했는데...저 시절 누군가는 내가 싫어하는 비 오는 여름날을 평생 그리워하며 살았겠구나. 나는 이 공기를 그리워하는 사람들이 지킨 땅에서 살고 있구나. 기분이 묘해요.
작가님께서 표현하는 조선은 눈물날 정도로 아름답네요. 많은 미사여구로 붙이지 않아도 저렇게 아름답게 말할 수 있구나 싶어서 매 화를 볼 때마다 놀라고 존경스럽습니다...
"작가님 대단하신 게 이전 화에서 해수와 의현이 대립할 수밖에 없었던 이유를 최근 화들로 납득시켜 주시네요. 의현은 간도 참변으로 나름의 트라우마를 가지긴 했지만 어디까지나 참변에 직접 휩쓸리지 않은 제3자적 입장이었고, 해수는 눈앞에서 가족과 주변인이 몰살당했으니.. 폭력을 사용하지 않고 독립운동을 하겠다는 의현의 스탠스는 해수 눈에 지나치게 이상적인, 혹은 뭘 모르는 사람의 주장으로 비춰질 수밖에요"
아...다음화가 보기 싫다...해영이가 죽어가는 모습....해수엄마아빠 총맞는 모습....빨리 도망치라고 외치고 죽어가고......절망하면서 녹주만 겨우 붙잡고 울면서 달리는 해수가 머릿속에 그려진다고.....
해수 동생이 말한거 의인화하면 수아 아닌가? 진짜 인어공주를 이렇게 표현하다니 작가님은 천생 작가시구나
물 비린내 나는 조선을 찾아왔는데 그와같은 '수아'가 있다니 해수에게 있어서 수아와의 만남은 운명처럼 느껴지네 비록 목소리를 빼앗아 갔지만... 의현이가 달을 보고 수아를 떠올린다면 해수에게 있어서 수아는 물비린내 나는 조선의 인어공주구나... 이 작품에서 주목해야할 건 의현보다 해수로 보임
작가님 응원하는 맘으로 일부러 쿠키로 봅니다 우리 작가님 이정도 퀄리티면 네이버 웹툰 1위해야하는거 아니냐고 네이버 일좀해라 이것들아.. 옆동네로 갔으면 더 좋았을텐데 급식툰에 밀려서 이런 엄청난 대작이 밑에 있는게 넘 안타까움..
물 냄새가 섞인 공기.. 떠올리는 것만으로도 그리워진다고..... ㅎ ㅏ.... 나 운다...
해수는 어떻게 견뎠을까요 잘 상상조차 가지 않는 참담함을...부모님이 돌아가시고 동생이 죽고 살던곳을 잃고 잘 억나지않는 조국을 찾기위해 그림자로 사는 삶...고향에서 구해온 어린 녹주가 죽는것까지 봐야하는 삶은 어떤 삶인가요...이상하게 고래별에서는 해수와..이미 죽어버린 윤화아가씨..이 둘이 너무 마음에 밟히네요
다른 웹툰하고 다르게 여기는 감상평이라고 해야 할 정도로 수준 높은 댓글이 많다 내가 이 웹툰 쿠키굽는게 작가님 작화랑 스토리가 좋아서 굽는 것도 있지만 여기 댓글도 한 몫함
내가 없는 동안은 어머니가 가장이다... 이 말이 왤케 좋지....
"뜨자마자 바로 결제했다 ,,,,,, 전혀 아깝지않은 내 쿠키 ,,, "
저 때 왜놈들이 쳐들어오지만 않았다면 해수가 목소리를 뺏고 수아가 목소리를 잃을 일은 없었겠지..
시리즈에서 영구소장하고 웹툰 들어와서 덧글보는 사람 또 없나ㅋㅋㅋㅋㅋㅋ 매주 정주행하고 곱씹어야되거든여 하 미치것다진짜 
다음 편 진짜.... 못 볼것 같아요...😭😭
해수네 아빠 떠날때 해수보고 네가 이제 가장이다말하는게 아니라 엄마가 가장이라고하는거 왤케좋지..애들한테 짐 안지어주는 참부모같아서
내가 없는 동안은 네(장남)가 가장이다 라는 식으로 말 잘 하는데 엄마가 가장이다 라고 하는 게 좋아요 당시 여권 엄청 낮았을 텐데 어머니를 존중해주는 것 같아서... 작가님께서 작은 부분도 신경 쓰셨을 거 같아 좋아요 
봄을 기다리는게 우리의 본성이라는 대사가 참 가슴아프다...35년간 봄을 기다렸을 조선 백성들의 심정이 느껴지는 대사네요
"작가님 스토리가 탄탄한거는 두말하면 잔소리지만.. 그림체도 진짜 감탄스럽네요.. 나무 잎사귀 사이에 비친 햇빛, 딱 봐도 혈육인게 보이는 해수와 해수어머니.. 작가님의 그림은 스토리에 더 빠질 수 있게 만드는 큰 요소인 것 같아요.. 신체가 기형적여 보이는 구석이 하나도 없는 이런 수준급 그림체신데 어떻게 스토리도 이렇게 완벽하죠ㅠㅠㅠ 덕질을 할 수 밖에 없는 작가님 ㅠㅠ"
해수의 과거 이야기 좋네요이야기가 점점 농밀해지는 느낌입니다 작가님 표현력도 더 풍부해지신 거 같아요 써주셔서 감사하단 생각이 드는 작품입니다..
자꾸 작가님작가님 해서 진짜 작가님 말하는줄 알았네ㅋㅋㅋㅋㅋㅋㅋㅋㅋㅋㅋㅋ
"작가님....묘하게 사함이에 대한 집착을 가지고 있는거 같은데. ""나만이 감사함의 비밀을 알고 있다.""라는 점에서 위안을 얻고 본인만이 사함을 가지고 싶어하는..... 좋아하는 방식이 잘못 되었어요 작가님...ㅠ 작가님은 얀데레 서브남주 루트인가"
작가님도 사함이 좋아하나봐ㅠㅋㅋㄱㅋㅋㄱ 완벽한 짝사랑 구도 오지고요...
작가님도 예전에 다 얘기했다가 상처받아서 그런거같아요!들켜도 계속 사함이편일듯
꺼져 이 음침한 놈아
"이번화 요약1. 작가님이 사함이를 짝사랑한다던가, 작가님도 상대방에게 비밀을 말했다가 당했던 과거가 있었을것.2. 사함 우리 손잡는거 설렘포인트3. 마지막에 똥밖에 안보여서, 누군지 파악불가"
근데 작가님 뭐지뭐지 왜 사실대로 말하지 말라는거지 ㅠ 누구보다 사함이편인 작가님이... 옛날에 사실대로 말했다가 데인적이 있는건지 아님 사함이가 우리랑 헤어졌으면 좋겠어서 그런가 ㅠ
작가님이라 해서 지수작가님인줄..ㅎㅎ
다 모르겟고 아빠새끼진짜입벌려오함마들어간다
남준일 친구는 걸러
자연스럽게 손 잡는거 왜이리 설레냐
헤헤 빵 구웠어요!
ㅋㅋㅋㅋ 나도 진짜 작가님인줄 알아서 혹시 작가의 말에 뭐 적혀있나 보고 왔네
저 검은발암시키 조지러가실분 구해요 (1/1000000000)
지금까지 있었던 일 들 생각하면 김이도 작가님이 사함이한테 마음이 있을만하지
저런 환경에서 사함이가 잘 자란게 대견함
와 진짜 아빠랑 동생이랑 똑같네 아주 그냥 지 행복만 찾냐..누나라 부를테니 폰을 사달라니;; 제정신이 아냐 그런데도 사함이는 잘 컸어.. 진짜 대단해..
저런 담임선생님이 얼마나 될까...직업정신 ㄷㄷ...
사함이 진짜 도망쳐서 다행이다 생각했던것보다 훨씬 괴롭게 살았구나...저거 다 가정폭력이고 가해자 잘못인데 아직도 집안에서 일어난 일은 집안에서 해결하라는 식으로 쉽게 본다던가 피해자보고 맞을 짓 했네 어쨌네 하는 사람들이 있어서 더 안타깝고 화가 나요 그리고 가족끼리 사이 안 좋다는 얘기하면 그래도 가족인데~라고 얘기하는 것도 너무 싫어요 저렇게 괴로운 관계가 가족이라니 말이 되는 소리를 해...
와 진짜 저게 아빠냐 열등감밖에 없는 새끼
ㄹㅇ 나같았으면 이미 가족이랑 연끊고 혼자 잘먹고 잘 살았겠다.사함이 완전 착하네 저런것도 가족이라고
아빠 개싸이코 아님..? 진짜 저런 집에서 어떻게 정상적으로 사함이기큰 거지..?
아빠도 아빤데 동생이 아빠 빼다박앗네
그게 왜 사함이 잘못이야 사함이 너의 잘못 아니야 망할 애비 동생같지도 않은 저 놈과 잘 알지도 모르면서 떠드는 ㅅㄲ들이 문제지 
집 안에 정상인 사람이 없네 사함이 집 잘 나옴
사함이가 똑부러지고 사람 잘 못 믿고 하는 이유가 있었네 ..가족이 저러는데 다른 사람은 어떻게 믿겠어
난 근데 결혼해서 연 끊는거보다 사함이 맞서서 복수하고 연 끊었으면 좋겠음 저걸 어떻게 그냥 넘어가 고소해서 범죄자로 만들어버리든 해야지
이게 무슨 사함이 잘못이야 모든 잘못은 가해자의 잘못이다 피해자는 죄 없다 방관자가 피해자에게 왜 그대로 당하고 있지 않았냐고 다그치는 그런 세상이 잘못된거다 사함아 잘 컸어 행복해라 가족이라고 부를 필요 없는 저런 가족 버려..
빨리 사함이 작가님이든 우리든 하나랑 결혼해서 저 집구석이랑 연 끊고 행복하게 사는 거 보고 싶다
가정폭력에 혼자서 잘 하고 있는 딸 앞길 고의로 막아버리는 OOO 한마리에옆에서 누가 폭력을 하고 당하고 있어도 안들리고 안보이는 척 모르는 척 하는 쓰레기 한마리도움을 주거나 다른데 도움을 요청하거나 아이를 보듬어주지 못하는 약한 엄마여기서 어떻게 정상적으로 자라냐...사함이 대단해...근데 가족들 중에서 사함이가 거의 폭력 다 당한 것 같은데 그렇게 나간 딸한테 가서 돈 달라는 소리를 한다고?허 진짜 개어이없고 개화나....
"하..... 제 이야기와 비슷하네요;;;; 저도 알코올 중독자이신 아버지가 게시고 집안도 가난합니다.... 동생은 3명, 저는 첫째라서 제가 거의 모든 일을 해야했죠. 제가 20살이 되어서 면접을 보았을땐 하늘을 날듯 했습니다. 2차 면접까지 통과했거든요..... 그런데............. 아버지란 놈이 술에 취해서 저에게 폭력을 가하였습니다. 결국 저는 면접장에 가지 않았고, (못하였고), 결국은 집을 나왔습니다. 지금은 서울대에 과탑으로 인정받는 사람이 되었습니다. 이 웹툰을 보면 조금씩 제 과거가 생각나서 참 많이 울고 갑니다."
애비새끼가 대가리는 장식이냐?
"ㅋㅋ아빠는 사함이가 독립해서 안정적으로 살 수 있었는데 지 열등감 때문에 다 망쳐놓는 뇌 상태 에바다 ㄹㅇ;; 사함이가 뭐 잘못한 게 있다고 어린 여자애 때릴대로 다 때려놓고 한 번 쳐서 머리 4개 꼬맸다고 z랄도 가지가짘ㅋ 니 그 생각도 안 하는 머리 살짝 찢어진 거랑 니 자식들이랑 아내 심리적,  육체적 피해 다 합치면 비교는 될까? 그리고 소문은 왜 내는지ㅋㅋㅋ 가족이 경찰에 신고하거나 니 소문에 제대로 반박했으면 닌 바로 매장 당했던 거야ㅋㅋㅋㅋㅋ 그딴 소리 믿어주는 동네 사람들도 정상은 아니다 맨날 술 먹는 아저씨가 술 마시고 고래고래 소리지르는데 구급차 소리 시끄럽다고 민원 넣는 대한민국에서 니는 민원은 안 들어왔니?? 사함이 알바는 가게 이미지 땜에 짤린다고 해도 엄마 직장은 또 왜 잘려 사함이가 회사에 관련이 있는 것도 아니고 소문에서 딸 정상 아니라고 해서 잘리는게 말이 돼? 가족 생계 엄마한테 달려있는 거 알텐데 ;; 왜 사함이 옆에는 날파리 같은 것들만 꼬이냐 ;"
경찰이 말하는 가정 내 문제는 가정에서 해결하라는 저 한마디 요즘도 똑같습니다 경찰들이 귀찮은건지 법적으로 개입이 안되는건지 정확하게는 모르겠는데 저게 개한민국 현실이에요 주변에서 저 지랄이 벌어지고 잇는 사람 있으면 따뜻하게 보듬어줍시다 저렇게 배척하지말구요
근데 왜 엄마 얘기는 없지? 엄마도 가해자임. 아무것도 안했다고 아무죄가 없는게 아님. 맞고 있는데 보호하기는 커녕 집 나온 딸 찾아가 돈달라고까지 하네... 사함이 제발 행복해져라ㅠㅠ
우리 형저색기 미친거아님? 사함이가 저거 우리한테말하면 우리 다시는 형 색기 안볼것같은데? 사이다좀 날려줘 제발
사함아 그냥 우리한테 말하자;;언제까지 이렇게살래.. 헤어지든말든 이게옳은거야 일단말하자
가족 입장에서 저런 거짓말 하는 사람을 오냐 웰컴 해주는게 더 이상하자나.... 돈봉투말고 사진 나름 참신했는데 왜그랭
"사함이가 진지하게 마음터놓으면서 우리랑 과거이야기 다하고 ,, 형의 트롤짓을 알려주고,, 우리가 빡쳐서 형이랑 절연 선언하자.. 그리고 형색기 후회하며 우리가 사함이앞에서 사과하세요 하고 사이다 날려줬음 좋겠다 "
뒷조사하고 면전에서 꺼리는얘기 콤플렉스얘기 다 꺼내는데 형님은 잘못이 없다 생각하십니까? 우리가 형앞에서 천사가 아닌 악마가 될겁니다....
근데 사함이 아무리 잘못했어도 뒷조사 했다는거 자체가 일단 꽝 아니야?
으으윽 우리는 저렇게 착한데 왜 저 형색기는 왜저러는거야;;
