댓글,긍정/부정
민수 성장하는 거 ㄹㅇ 감동이다 웹툰 처음 볼때까지만 해도 속을 알 수 없는 선배 정도였는데 지금은 완전 어른같네 ㅠㅠ
춘배는 일반인인데.. 맘대로 애정퍼부어놓고 보답을못받았다고 그러는거냐고.....
근데 나만 저 춘배야 팬들 별로냐?춘배 있을때는 춘배님 사랑해요♥춘배님 밖에 없어♥ 춘배뿐♥ 이러면서 다 퍼주다니 춘배 사라지니까 사실 보답을 못 받았다느니 답답하다느니 하면서 춘배 까네 
(전) 춘배야 회원들 좀...; &gt;퍼주는 애정에 비해 보답을 못받는 느낌이었다&lt; 고 하는데... 자기들이 좋아서 자기들 마음대로 애정을 줘놓고 퍼준 애정에 비해 자기들이 보답을 못받는 느낌이었다고 하면 뭐라 답해야 돼..? 그동안 보답을 바라고 애정을 퍼준거였나
저 고양이 두마리...어디서 본것같은데...?
춘배야....보고 싶다...... 진짜 나비가 너의 흔적들 다 없애는 것 같아서 무섭고 속상하다ㅠㅠㅠㅠㅠㅠㅠㅠㅠㅠㅠ
흑발계략미남을 어떻게 미워해
헐..혹시나봣더니 진짜 나비 인스타계정생겻어!.!..!.!.!!!!!!
춘배야 너무해ㅜㅜㅜㅜㅜ따지고보면 춘배가 연예인도 아닌데 팬서비스같은 보답을 바라는게 웃기는거 아닌가......자기들이 멋대로 일반인(묘....) 덕질하면서 쫓아다닌거잖아.....
춘배 잘살고있냐..
나비 인스타 보미만 팔로우한거 귀염뽀쟉
나비..이제보니 좀 징그럽긴해도 불쌍한 것 같아요. 춘배의 자리를 대체하는 것만이 자기가 살길이라고 생각하는지..욕심많고 음흉하지만 비뚤어진 애정갈구랄까..근데 확실히 남의 감정은 이해하지는 못하는 것 같네요.
난... 나비 등장 때부터 나비파... 싸한 거 알고 잘 못도 아는데 캐릭터가 매력적이야..ㅜㅜㅜ
물론 춘배가 좋지만난 나비볼때마다 넘나 짠한맘이 든다.나비가 행복했으면 좋겠다 
저 여우자식 나비폭스...
춘배와 나비 티콘은 나오는걸로 알고있는데.. 나비 단독 임티도 만들어주세요오 8ㅁ8
나는 보미가 싫어하는데도 같이 있고싶다하는 나비가 존나 싫다
나비파 싫어요춘배파 좋아요
휘혈이이모티콘도 시간있으면 만들어쥬세요🙏🏻
저고양이두마리 그 스파이냥이들 아니에요?
작가님...알프레도..이모티콘도..내주시면..안되나요...?
진짜... 뭐라해야 하지.. 타이밍..이라해야할지는 모르겠는데 춘배 냥국으로 떠나자마자 나비가 인간세상에서 행동하고 지냄으로써 춘배의 흔적들을 없애는것 같음ㅠㅠㅠㅠㅜㅠ 진짜 전부터 계획한 것 같달까ㅠㅠㅠㅠㅠ
나비 그냥 인간세상에서 사는게 100배좋겠네 냥국에선 엘리트인데 둘째라고 개차반취급하고...ㅠ걍 인간세상에서 살아라
나비야 너무하다 어떻게 글만 알면 풀 수 있는문제라고 하니
신뢰는 다시 쌓을 수야 있겠지.. 그렇지만 한 번 무너진 신뢰가 다시 쌓는다고 쉽게 쌓일까...
벌써부터 춘배가 너무나도 보고싶다보미도 영상보면서 춘배 보고싶어하잖아빨리 돌아와서 보미랑 만났으면 좋겠어ㅠㅠ
춘배가 떠났어도 춘배랑 자길 비교하고 더 잘해서 인정받으려는건 그대로구나 나비야...
아니 본인도 대체제가 되면... 나중에 참 씁쓸하고 공허할 텐데
근데 나비는 그런 뛰어난 능력을 갖고 있었는데도 냥국에서 그런 취급이었으니까....인간세계에서 춘배보다 낫다는 걸 증명하려고 안간힘을 쓰는 거일듯....그래서 조오오오금은 안타깝고....휘혈이가 그걸 또 눈치 챈 게 좋고.....둘이 서로의 마음 알아가는 거 같아서 그런 면에선 좋다
사랑받고 싶었을뿐인데 어딘가 일그러져 버리고만 나비가..너무 안쓰럽다..😿
그래도 보미한테 버려지는건 무서워하는듯
나비는 처음부터 냥패도 다 팔아버리고 보미를 만나기 위해 인간세상으로 온거라고ㅠㅠ그러니까 보미 주변을 멤돌수밖에 없는건데..어렸을 때 추방당했을 때 자기를 보살펴준 보미 주변을 멤돌수밖에 없다구ㅠㅠ
나비 떨고 있었다는 거 보면 나쁜 고양이는 아닌 것 같고 그냥 애정결핍이라 인정받고 사랑받고 싶어하는 고양이 같음 주인공 몰아내고 자리 꿰차서 역적 취급 받을지라도 난 널 믿는다 나비야 앙큼 애옹아
춘배보고싶어요..(엉엉
근데 솔직히 보면 나비도 인간세상에서 사는게 좋은 선택일수도있음..은 무슨 춘배야 기다리고있어..온리춘배..빨리와..
나비티콘 존버단 222٩(*ᵕ̣̣ωᵕ̣̣)۶❤✨❤✨❤✨
"아니,나비넌 춘배의 순수함을 이길수 읍서"
아니 나비는 처음부터 정착하려고 했고 춘배가 있든 없든 계속 진실을 말했고 그런 준비를 꾸준히 해왔는데 이런 형태가 되어버리니까 욕 먹는 거 너무 싫었다고... 뭘 춘배 자리를 빼앗아... 얼굴이 똑같다고 사람들이 갖다 붙이는 것뿐이지...
물타기 겁나 빠르다 회원님덜ㅎㄷㄷ
나비 약간 애정결핍 같은거 아님? 둘째라는 이유로 가족들한테 사랑도 못 받고.. 떨고있다는거에서 마음 다 와르르맨션 됬자너 그냥 춘배고 나비고 둘다 행복하게 살았으면...
와진짜 저사람들 싫다 저렇게 쉽게 갈아탈거 왜 카페에서 그 지X 염X을 떠는지 그럴거면 애초에 나비 팬해라 저번엔 나비가 누굴 때렸다느니 어쩌구했으면서
"그냥 이런생각 하면 안되는데... 춘배가 냥국에 돌아감으로써 춘배가 있었던 곳들을 나비가... 채워나가고 있는 느낌... 평화로워 보이는데 그렇지 않은 것 같고, 전과 같은 일상인데 그렇지 않은 느낌...."
헐 나비 보미가 다니는 대학에 입학까지 한거야??!!! 철저하네....
민수 캐릭터가 귀여워진 느낌ㅋㅋㅋ근데 저 꼰대 안경은 보미가 한번더 시원하게 때려줬음 좋겠다^^
영철아 보고싶어
근데 여러분 그거 알아요..? 냐한남자 단행본 나온거..?? 아무 언급도 없길래..ㅜㅠㅠ 표지도 진짜 예쁘고 잘생겼구요.. 초판한정으로 같이 오는 엽서 진짜... 귀여워 죽어요... 응24에서는 포인트 차감으로 이지랑 춘배 중 랜덤으로 스티커도 주는데 뭘 받아도 좋을 것 같은 귀여움... 다들 알죠..? 빨리 왔음 좋겠다..^^.....
기근 같은 소리 하네 저주는 니가 이 과에 있는 게 저주고
나비가 아예 춘배 자리를 꿰차려는구나..
내가 다 불안해..계속 아슬아슬한느낌 ㅠㅠ
영철아 춘배야.. 잘 도착했니... 뭐하니... 벌써 보고싶다 얘들아...
와 내가 춘배 진짜 사랑했나봐 나비 저러는 거 거부감 오지게 든다....
나비한테 전혀 정이 안가는게 처음부터 쭉 자기가 원하는걸 위해서라면 남한테 피해를 주더라도 쟁취하려고 하고 그로인해 상처입은 피해자들한텐 죄책감조차 없음.. 게다가 나비는 무슨일을 할때마다 춘배처럼 순수하지 않고 뒤에 꿍꿍이가 너무 많아서 춘배자리 꿰차는게 더 보기 싫은것도 있다ㅜ 춘배 돌아와ㅜㅠㅜ
으음.... 뭔가 나비 보면서 껄끄러웠던건 나뿐인가..?
난 쟤 왜이렇게 정이 안 붙냐 생긴것만 똑같지 하는짓은 너무 얍삽하고 별로다
나비가 만든 음료 예쁘긴 한데 맛은 어떨지??? 겉만 예쁘고 맛은 별로인 거 아녀?? 암튼 철저하게 김춘배 빈자리를 채우려고 하는구나
나비 주인공처럼 만들면 울거에요!!!!!! 춘배 대려와여!!!!!!!!!!!
나비 그냥 싫어하는게 아니고 이때까지 나왔던 장면들이 모두 폭력적이고 이기적이었는데 당연 싫어하지.. 나비 시점에서 볼때도 우리나비는 불쌍해 어쩔수 없었어! 이렇게 전개가 흘러가는 장면 나와도 난 나비 싫음
어차피 남주는 춘배일 거잖아요ㅠㅠ 나비 그만 미워했음 좋겠다 난 나비 고양이로밖에 생각이 안 돼서 그런가 너무 짠해 나비는 어릴 때 주인 찾고 싶었던 것뿐인데 나비도 행복할 권리가 있는데.. 이번 춘배나비티콘도 그렇고 나비 너무 미워하는 거 같아요 나비 단독티콘 원하는 사람도 있다구요.. 춘배는 이모티콘 3개나 이미 있는데 춘배나비로 해서 이모티콘 중에 춘배 단독으로 나오는 이모티콘이 나비 단독으로 나오는 이모티콘보다 더 많고.. 나비티콘 나비만 해서 내줘요.... 진짜 너무 슬퍼 안 그래도 깜장 고양이는 사람들한테 편견 있는 고양인데.. 깜장 나비도 좀 예뻐해줘요.. 고양이니까 그럴 수 있잖아요... 고양이잖아....
나비도 불쌍한게 능력은 있는데 둘째라 왕도못되고 사랑도 못받아서 욕심도 많고 뭐든 다 잘하는것 같다ㅜ
미리보기 2개씩 내주실 거 아니면 창범이 두들겨 맞는 거 또 보여주세요
나비쉴드왜침 개불쾌한데
"나비가 이 틈을 타서 춘배의 빈자리를 채우려고 하는 것 같은데,,, 아니 쟤 진짜 뭔 생각이람 김나비너는진짜"
나비가 춘배역할을 하려고 해도 아무래도 성격이 다르니까...
영철이 용기내서 냥국으로 돌아간다고 하니까 좀 아쉽네영철이 냥국에서 자신이 이루고싶었던거 이루고 돌아와서 지나랑 다시 재회했음 좋겠어
휘혈이 나비한테 또 기대했다가 또 상처 받을 각인데....휘혈아 그 관계 안좋게 끝날 거라는 플래그 세운 거 같은데....행복하자.....
춘배자리를 탐내는거니ㅠ
보미랑 지나 생각보다 되게 덤덤하네...... 나만 일케 슬픈거냐ㅠㅠㅠㅠㅠㅠ
김나비 인성 문제있어?
휘혈아 행복하자ㅜㅜ
영철이랑 춘배 다시 눈떴는데 돌아왔으면 좋겠음 춘배도 춘배지만 영철이한테 진짜 정 많이 들었는데..
춘배랑 같은 얼굴인데 나비에게는 왜이리 정이 안 갈까...
휘혈이 불안해ㅠㅠㅠㅠㅠ
121화에서 나비 보고 불쌍하다고 했었는데 이제는.......하.... 글구 휘혈이 위태로워 보이는데 불안하네.........
돈 떨어졌나
춘배야 다시 돌아오면 안되겠니?
난 나비 편이야... 마이 리를 블랙 키티...
지나 얼굴 빨개지는 것 봐 영철지나 미쳐 ㅠㅠ
지나 얼굴 붉혔네???????? 영철지나 찐이야?????
돌아오는건...스토리상 무리라구 해도 냥국시점 춘배 영철 근황 나왔음 좋겠다 ㅠㅠㅠ
자까님..저는요..아직도..나비를 잊을 수가 없어요.. 깜장한 털이..너무 귀여운디..나비티코온..만들어 주심.. 안댈까요..?
나비 춘배자리 있다가 카페에선 춘배 성격 더러워졌다고 평판 떨어질꺼고 휘혈이는 또 배신당할꺼고 하. 나비 그냥 꺼져
님들 표정┏━━━━━━━━┓　　　　┏━━━━━━━━┓┃　　　　　　　　┃　　　　┃　　　　　　　　┃　　////////　　　　　　　　　　　　////////　　　　　　┃　　　　　　　　　　┃　　　　　　┗━━━━━━━━━━┛♥
Rlp. 이지 겨드랑이65화에 잠들 예정.
오로지소이지못참지아마도지모쏠이지
이 웝툰은 쿠키를 구워가며 볼 가치가 있어.!
작가님이 다음주에 그리면 안되는것들1. 기고가 부끄러운 나머지 사진 찢어버리는 것2. 주변에 로지 있는데 정색하면서 아무사이 아니라는 것
밖에 있는 까마귀야 닥치고 있거라지금 나 슬프다...
스티커 사진 찢어버리면 작가님 진짜 안됩니다
쿠키가 아깝지 않아한화에 1000원이여도 본다 ㄹㅇ
로지가 진짜 기고랑 같이 다니는 모습만 보여준 거지 확실히 로지 학교에서 인싸 중에 인싸 아님?꿰매긴 했어도 바로 퇴원하고 오긴 했지만 저렇게 책상 위에 수북히 쌓일 정도로 선물 공세를 받은 거 보면 저 세계 안에서 인기 엄청날 듯 우리가 빼빼로데이 때 누구 책상에 여러 사람이 쌓일 정도로 빼빼로 받는 사람 드문 거 생각하면 저거 진짜 대단한거임 ㅇㅇ
진짜 달달하다
아이씨 광고를 웹툰으로 봤네
로지 선물 받을때 왼쪽에 왕자림 있음 ㅋㅌㅋㅋ
이 웹툰 보다보니 별로네요제 입꼬리가 별까지 가버렸어요
ㅈㄴ 억지광고인데... 잘만들었어
난 왜케 이지가 좋지? 선 안넘고 재밌는 상황을 만들어줌ㅋㅋㅋㅋㅋㅋㅋㅋㅋㅋㅋㅋㅋㅋㅋ
서로 손을 잡은적이 있나요?                         네집에 놀러간적이 있나요?                             네상대방의 부모님을 뵌 적이 있나요?             네간접 뽀뽀를 한 적이 있나요?                        네볼 뽀뽀를 한 적이 있나요?                           네데이트를 해봤나요?                                     네일부로 다쳐서 병문안을 간 적이 있나요?    네무릎배게를 베고 잤나요?                             네한 침대에 둘이 있던 적이 있나요?               네손하트를 하고 사진 찍은 적이 있나요?        네둘이 사귀나요?                                            아니용????????????????????????????????????????????????
"57화에 보면 ""a butterfly sitting on a flower"" 이 있는데 오늘 로지 머리핀에 나비가 앉았네요 로지는 꽃입니다 꽃처럼 예쁘죠 "
나만 썸네일 기고 웃는거 보고 설렜냐
"━━━━━┓┓┓┓┓┓┃/ . `┓┓┓┓┓ : .＼○ノ (와장창)┓┓┓┓┓┃ ` / 　로지야 날 가져 엉엉　┓┓┓┓┓┃ `ノ) . `┓┓┓┓┓┃ ,┓┓┓┓┓┃　　　 　○ 주그면  로지눈나 못봐┓┓┓┓┓┃　　　 　人 (사뿐)┓┓┓┓┓┃　　 　　/)┓┓┓┓┓┃　 ┎━━━━━━┒┓┓┓┓┓┃ 　┃┏┓┏┓┏┓┃ 　 ○┓┓┓┓┓┃　 ┃┗┛┗┛┗┛┃ 　 人┓┓┓┓┓┃　 ┃┏┓┏┓┏┓┃ ...../) (총총총)"
⠀⠀⠀⠰⡿⠿⠛⠛⠻⠿⣷⠀⠀⠀⠀⠀⠀⣀⣄⡀⠀⠀⠀⠀⢀⣀⣀⣤⣄⣀⡀⠀⠀⠀⠀⠀⢸⣿⣿⣷⠀⠀⠀⠀⠛⠛⣿⣿⣿⡛⠿⠷⠀⠀⠀⠀⠀⠘⠿⠿⠋⠀⠀⠀⠀⠀⠀⣿⣿⣿⠇⠀⠀⠀⠀⠀⠀⠀⠀⠀⠀⠀⠀⠀⠀⠀⠈⠉⠁⠀⠀⠀⠀⣿⣷⣄⠀⢶⣶⣷⣶⣶⣤⣀⠀⠀⠀⠀⣿⣿⣿⠀⠀⠀⠀⠀⠈⠙⠻⠗⠀⠀⠀⣰⣿⣿⣿⠀⠀⠀⠀⢀⣀⣠⣤⣴⣶⡄⠀⣠⣾⣿⣿⣿⣥⣶⣶⣿⣿⣿⣿⣿⠿⠿⠛⠃⢰⣿⣿⣿⣿⣿⣿⣿⣿⣿⣿⣿⡄⢸⣿⣿⣿⣿⣿⣿⣿⣿⣿⣿⣿⡁⠈⢿⣿⣿⣿⣿⣿⣿⣿⣿⣿⣿⠁⠀⠀⠛⢿⣿⣿⣿⣿⣿⣿⡿⠟⠀⠀⠀⠀⠀⠉⠉⠉왜 안사귀는걸까????
"사진 잃어버리지 말라고 당부하는 걸 보니 칠칠이 이기고는 높은 확률로 사진을 잃어버릴테고 그걸 줍게 된 쏘이지는 손 하트를 보고 사귀는 것으로 100% 확신하게 되어 반에 사귄다고 소문을 내게 될테고 당황한 이기고는 아니라고 하려 하는데 오로지가 사귀는 거 맞다고 말하면서 내기에서 진 사람이 소원 들어주기로 했잖아, 그럼 고백 받아줘 라는 식으로 흘러가게 되는 전개가 이어질 것 같진 않지만 일단 사귀었으면 좋겠으니 직접 콘티를 한번 짜보았습니다."
내일 2시 논산입대인데 진짜 훈련소 기간동안 로지기고 보고싶은거 어떻게 참냐ㅜㅜ로지 기고야 형 다녀올게 잘 지내고있어😂😂😂😂
오로지사랑해
머리핀 때문에 다쳤지만 머리핀을 선물하는 이기고좌
하..진짜 볼때마다 설레기만하는 내인생이 레전드다
공시 2년차 일주일 뒤에 시험인데심신이 너무 피폐해졌습니다.이 웹툰 같은 사랑을 해본적이 있습니다.베댓에 있는것처럼 다 네 네 네 네 였고 마지막 질문만 아니요였죠 ㅎㅎㅎ.. 이나이먹고 그렇게 귀엽고 아기자기하게 서로가 우리 지금 진짜 귀여운거 아냐고 물을 정도로 달달구리한 경험을 하게 될줄 몰랐죠 ㅎㅎㅎ.잠깐만 기다리면 합격해서 짠 하고 나타나 제대로 해보자고 말하려고 잠시 멀어졌는데. 생각만큼 일이 풀리지 않았고.낮아진 자존감에 감히 나같은게라는 생각으로 연락을 못했습니다. 반년을 후회로 살았고 하루에도 수십번씩 사진을 보며 오만가지 감정을 있는 그대로 홀로 독서실에서 처절하게 느꼈습니다. 너무너무 찌질한 제가 너무 싫었습니다. 할수 있는거라곤 사진보는게 다인 제가 싫었고. 사랑을 핑계로 공부에서 회피하려는 제가 싫었습니다. 너무 찌질하죠 저 ㅎㅎ..? ㅎㅎ 그래도 토요일 밤마다 이 웹툰보면서 가뭄중 단비를 느끼고갑니다.작가님 늘 건강하세요 정말 감사합니다!
야 사귀라고
"			|      내 사랑 로지,기고에게.     |			| 제 돈을 다 바치겠습니다  |			￣￣￣￣∨￣￣￣￣￣￣￣			　　　 ∧_,,∧			　  　(`･ω･´)			　　　Ｕ θ Ｕ			　／￣￣｜￣￣＼			　|二二二二二二二|			｜　　　　　　 ｜			찰칵       찰칵   찰			∧∧└  ∧∧     칵			　(　　)】 (　　)】			　/　/┘　/　/┘			ノ￣ヽ　ノ￣ヽ{ 줄 돈은 있나요?!속보=어떤 독자••• 로지랑 기고에게 전재산 바친다면서 줄돈이없어 감옥에•••			"
"ㅡㅡㅡㅡ제발 지켜주세요ㅡㅡㅡㅡ-🚨코로나 국민 예방수칙😷1. 🚰흐르는 물에 🧼비누로 꼼꼼하게 👏🏻손씻기2. 🤧기침이나 재채기할 때 옷소매로 🤭입과 코 가리기3. 씻지 않은 손으로 눈·코·입 만지지 않기🦠4. 🌡발열, 호흡기 증상자와의 접촉 피하기5. 의료기관 방문 시 마스크 착용하기😷6. 사람 많은 곳 방문 자제하기🗣👥👤🎡🏟🏖🏕💒❌🙅🏻‍♀️🙅🏻🙅🏻‍♂️ 정성들여 적었습니다 제발 지키자구요👊🏻"
뭐지? 17년 인생 저런 여친 없었는데 판타지물인가?
사귀자는 말 없이 자연스레 연인관계 되는 사람들도 많던데 그건가 ㅋㅋ
싸발 웃음이 멈추지않노
47컷 파란자동차안에 오직(오로지 아빠)있다 ㅋㅋㅋㅋ
엥 사귀지 않아요..?
제가 궁합어플로 봤을때 더이상 좋을수없는 최고의 궁합이라고 합니다 그런의미에서 이기고랑 오로지 사귑시다
자 여기서 이기고가 손하트말고 볼에 뽀뽀하면 아주 잼있을것같은데
오로지 부모님 배우였네로지 기고 뒤 오직 장미를 위해 포스터있네
이런 전개는 안됩니다.1.장난이라면서 둘이 하트 안만들기2.지나가던 애들이 목격해서당황한 기고가 사진 찢기
손을잡았나요? 네서로의 집에 놀러갔나요? 네간접뽀뽀를 했나요? 네볼뽀뽀를 했나요? 네데이트를 했나요? 네둘이 사귀나요? 아니요???
공부해
담배나하나펴야겠다
╭┈┈┈┈╯   ╰┈┈┈╮ ╰┳┳╯    ╰┳┳╯  이　    　　 사 제  　    　　 귀     ╰┈┈╯  는 ╭━━━━━╮　 세      ┈┈┈┈　　좀     　　 요
너희 서로 좋아하고있던거 너희둘빼고 전세계사람들이알아
"▬▬▬.◙.▬▬▬═▂▄▄▓▄▄▂◢◤ █▀▀████▄▄▄▄◢◤█▄ █ █▄ ███▀▀▀▀▀▀▀╬◥█████◤ 좋아하는 사람 이름══╩══╩═ 부르고 하강!╬═╬╬═╬ ኈ 오로지!╬═╬╬═╬╬═╬╬═╬╬═╬ ጿ 사뿐,,,"
베댓 애들 수련회가서 저거 못본다
암쏘이지
이거 진짜 내용 1도 모르는 사람들에게 이거 보여주면 '당연히 쟤네 사귀는 사이 아니에요?'라고 할 듯
수련회 안 가고 이러는건 진짜 개이득이지ㅋㅋ
이정도면 눈빛으로 고백한거 아님?
MBTI출연시키면 안되나
▬▬▬.◙.▬▬▬ ═▂▄▄▓▄▄▂ ◢◤ █▀▀████▄▄▄▄◢◤ █▄ █ █▄ ███▀▀▀▀▀▀▀╬ ◥█████◤ ══╩══╩═ ╬═╬ ╬═╬ ＼○ノ {둘이 사귀면 나좀 무덤에서 꺼내줘어어어!)╬═╬    / ╬═╬ ノ) ╬═╬ ╬═╬ ╬═╬
리발...벌써다봤어..
하.. 몇주나 쉬고 왔는데 아직도 안사귀고있다니..
여보세요 할때 '여보'랑 '세요'를 굳이 띄어놓는다?
엘레베이터 안에 있던  CCTV입니다. 직장인 아저씨께 별점 10점 드리죠.
이리 된 이상 오로지는 이기고에게 CGV나 가렴.
담임쌤 ♡ 보건쌤 오늘도 나 홀로 응원합니다
와 오로지는 이기고에게 GCV나 가세요 드립력 미쳤다;; 베댓에게 주어지는 카오스 혼테일의 목걸이 
CGV:그때부터였어요 제가 GCV가된게
CGV나 가렴 = 시집이나 가렴 (발음 비슷)
왜 로지 패션 말이없냐 나죽는다..
:)
젠장 CGV를 이길 드립이 떠오르지 않는다 
진짜 이걸 5주뒤에 보는 독자들이 너무 불쌍하다.. 하지만 더 불쌍한건쿠키가 많은데도 다음화를 볼 수 없는 우리다..
오로지와 이기고가 70화 안에 사귄다면 야동을 끊겠습니다
여보...❤️세요...❤️꺅 너무설레
ㅆㅈㅂ CGV로 안보고 싸지방으로 읽은 사람 분명히 있다그게 나거든
이번화 보면 이기고 봉숭아 물들인거 발톱은 전부 다빠졌고 작가님이 오른쪽 손 새끼 손가락에 손톱만 안그리거나 새끼 손가락을 아예 컷에서 잘라낸거랑 마지막컷 보면 봉숭아 물들인거 거의 다빠진듯오로지 만났을때 휴대폰든 손 보면 아직 오로지는 선명하고 이전화를 보면 이기고는 손톱 봉숭아 색칠 잘안되있고 그런데 오로지는 꾸준히 채색된거 보면 봉숭아 내기도 오로지가 이길듯솔직히 오로지 집에서 봉숭아 물들인거 빠질때 마다 다시 물들이는거 아니냐? ㅋㅋㅋㅋ 이기고 색 다빠질 동안 아직 선명하네 ㅋㅋㅋㅋㅋ
네 여보입니다
EZzzzzEzzzz진짜 이름 잘 지으셨다 ㅋㅋㅋㅋ
서로 카톡을 자주 하나요?네.병문안 가려고 2층 창문에서 뛰어내렸나요?네.주말에 단둘이 영화를 보러 갔나요?네.둘이 사귀나요?아니요.??????????????
둘이 같이 영화를 본 적 있나요?넹다리를 깨문적 있나요?넹무릎베개 해준적 있나요?히힝 넹서로 좋아하나요?..넹사귀죠?아니라고 몇번 얘기하는데;
이기고 블랙 셔츠!!!!!!!ㄴ갸야갸가ㅏㄱ아아ㅏ각각가각
다리를 배고 잤나요?네다리를 깨물어봤나요네한침대에 같이 있던적이 있나요?네사귀죠?아니요???
"임시우가 이기고에게 안되는이유.이기고:오로지가 걱정되서 2층에서 뛰어내리면서까지 조퇴함.임시우:학교""끝""나고 갈게.임시우:오로지&lt;학교 이기고:오로지&gt;학교사랑의대한 절실함부터가 다르다. "
╭┈┈┈┈╯    ╰┈┈┈╮ ╰┳┳╯    ╰┳┳╯ 다💧  　    💧주 음💧   　   　💧세     ╰┈┈╯  화💧 ╭━━━━━╮　 💧요      ┈┈┈┈　를💧     　　 💧~
작가님 싫어요 충들 신경쓰지마세요원래 인기 있을 수록 저런애들 많아요신경쓰지마세요언제나 재밌게 잘보고 있어요
Dc에서 오로지콘이 얼마나 인기인데 씹덕은 무슨 루리웹에서 dc인척 좌표찍고 온거구만
"디시인사이드 일동은 웹툰 ""오로지 너를 이기고싶어""를 적극적으로 지지합니다"
"상황정리루리웹 애들이 11시부터 12시 30분까지싫어요 테러를 함이유가 장난을 잘하는 타카기양인가?이딴걸 표절했다는 이유로그런데 이들은 DC, 일베 합동싫어요테러갤러리에서 왔다며 거칫말침팩트는 DC는 오히려 오로지 너를 이기고 싶어 팬 갤러리가 있고 그 갤러리는 폭발적이게 인기가 있음결국 루리웹 애들이 싫어요 테러해서베댓이 3개만 생겼고사람들이 루리웹애들이 DC, 일베로위장해서 싫어요테러한것을그대로 믿자그게 아니라고 설명하는게베댓됨참고로 DC은 정치성향이 보수 성향이고루리웹은 진보성향임루리웹은 그냥 일본애니보는씹덕  집합소임"
"ㄴㄴㄴ  밑에 봤는데DC 싫어요테러 갤러리 그런거 없음오히려 디시는 오로지 팬 갤러리로가득참저거 100퍼 루리웹에서일부로 일베, 디시인 척해서 싫어요테러 한거임루리웹은 오히려이 웹툰이 장난을 잘치는 타카기양?인가이 일본 애니를 표절했다고 오히려 욕하고안 좋아함"
