댓글,긍정/부정
그래도 서준이 수호 없는 동안 주경이 많이 챙겨줬네... 이번화 보면 좋은 남친이란게 느껴짐...하지만 미안 서쭌..... 난 수호파야 ...
한서준 이 자식 찐사랑이었네ㅠㅠㅠㅠ
결말은 진짜 뭘까...... 
ㅠㅠ 셋 다 행복하면 좋겠다..
그래서 남주는 누구인가요..?갈수록 남자주인공이 누구인지 몰르겠어요...
아니 근데 이해 안되는게 수호파라는 사람들은 자기 애인이 딴사람이랑 바람나도 괜찮은 사람들임?
얘네가 사귄지는 100일다되어가는데 우리는 1년째야
엥?99일밖에 안됐냐 니들???
주경이가 수호 눈사람 뿌시는 거 좀 아니지 않냐는 분들..잊으려고 애써 밝은 척 하려고 그러는 거잖아요. 너무 수호한테만 몰두하지 마세요. 아 물론 전 에이든파
근데 서준이 가정형편 어려운데 옷도 화려하게 다양하게입고 반지도사고 잘 매치가 안되는것같아요..
막컷에서 카톡확인 하려고 폰화면 확대한사람 조용히눌러라 그냥.
얘네 아직도 100일이야?? 한 1년은 된 듯
아고 서준이ㅠㅠ 서준이도 행복하게 해주세요
언제까지 질질...
???:안아프게 맞는법
"스토리 엉망이라고 하는 이유: 로맨스물에서 남주를 결정짓는 몇가지 요소들이 있음. 그 중에 4가지만 말해보자면, 1.제일 잘났음. 2.혼자 여주의 비밀을 알고있음 3.무언가 통하는 점이 있음. 4.같이 많은 시간을 보냄. 그니까 수호는 이 4가지에 완벽히 부합하는, 누가봐도 남주다. 하는 애였음.그런식으로 스토리가 흘러가다가 수호와 뭔가 본격적인 사랑이 시작되나?할 쯤에 수호가 해외로 떠남.그것 뿐만아니라 설정 자채가 화장으로 여신이 되는 앤데,뭔가 화장을 본격적으로 배워서 어떻게 실력이 늘고 하는 내용은 전혀 나오질 않음.설정을 정말 못써먹는 것 같음. 그러다 진짜 파국인게, 경연 프로그램ㅋㅋㅋㅋㅋㅋㅋ 이건 진짜 뭔가 싶음.에피소드도 뒤죽박죽이고, 진작 나왔어야 할 에피소드가 왜 지금 나오는지 ㅋㅋ 개연성 밥말아먹다가 욕을 너무 먹으니까 이제와서 수습하려는티가 너무 많이 남; 수습 안한 것보다야 낫다지만, 좋은 글을 많이 읽어본 입장에서는 진짜 헛웃음이 나오는 스토리 전개임"
"저 진짜 미안한데, 제발...위로 올려주시면 안될까요.베댓이 되면 작가님이 제 댓을 보실 확률이 높아지니까..제발 부탁드려요...작가님께 드리고 싶은 말이 많아요..작가님, 지금이라도 스토리나 밸런스 바로 잡으시고 가는게 좋을 듯 하네요. 조금 쉬다 오셔도 되니까, 제발 스토리 정리 좀 해주세요. 명색이 화요일 1위 로맨스 웹툰인데 123화가 되도록 남주가 오락가락한게 말이 되나요.서준파, 수호파 싸움까지 일어났습니다.나중에 드라마화 될 작품인데 스토리도 조금 신경 쓰셔야죠.작가님 그림실력이 너무 아깝습니다.야옹이 작가님 평판만 안좋아지고 있는 상황에서 글작가님을 들이시거나, 휴식기간을 거치고 스토리 재정비를 하지 않는다면 아마 댓글들이 비판으로 가득해지지 않을까 걱정이 됩니다.제 댓을 보실지는 모르겠으나, 제발 보신다면 독자들의 이야기에 귀기울여 주세요.제 최애작이었던 여신강림을 잃고싶지 않습니다."
스토리 진심 개망.작가가 양심이 없는게 한혜진이랑 다른 연예인들 완전 복붙으로 그려놓는데 그거 퍼블리시티권이라고 유명인들이 자신의 이름이나 초상화 등 상업적으로 허가할 수 일는 권리임. 근데 패러디도 아니고 복붙식으로 그려놓고는 양심의 가책도 없이 퍼블리시티권 얘기 꺼낸 독자들한테 고소한다고 고소장 냄. 인스타에 노출증인지 자기 몸매 자랑할 시간에 스토리 구성이나 제대로 짜길.남자 화장 경연대회도 화장하는 남자꺼 표절 논란 있는데 그것도 묵인하고. 작작하자 진짜. 이딴식으로 스토리 똥망인거 그림체로 계속 나가려고 하지말고 차라리 일러스트 원화작가로 활동을 하던가. 작품성 좋은 퀼 훨씬 좋은 작품들이 이런 유치한 설정 웹툰에 제대로 빛 못발한다는게 답답하다 답답해.
걍 작가분 스토리 역량 부족하신거 초반 지나고 이 쯤 되니 탄로나는듯. 그림체에 가려져서 여기까지 어찌저찌 온거임. 사람들이 착각하는게 만화가 회화나 일러스트도 아니고 캐릭터들이나 그림체는 어느정도만 사실적이면 그 외 내용 부분이 훨씬 중요한건데 만화를 일러스트로 착각하는건가 그림체를 보고 빠는게 참 이해가 안감. 이쁜 표지에 혹해서 산 책을 까봤더니 내용은 순 텅텅 아무 내용 없는 느낌
실제로 생각해보면 웃기잖아. 에이랑 비랑 내가 친구였는데 에이랑 썸탔다가 깨지고 비랑 사겼는데비랑 깨지고 다시 에이랑 사귄다는게..비한테 안미안함???게다가 에이는 못잊어서 티아닌 티내고 그걸 비가 질투하는 관계인데?본인이 비라고 생각하면 화날텐데 ㅋㅋㅋ
"서준아 미안해 난 그래도 수호야,,"
그림체는 ㅇㅈ한다
서준아 주경이 진짜 좋아했구나...
개인적으로 이제와서 수호랑 이어지기는 서준이랑 진도가 넘 많이 나간거 같기도 하다.. 크흠...
솔직히 드라마화 하더라도 학창시절에서 끝내야 할 것 같습니다...
이 웹툰은 진짜 결말이 가장 궁금함;;
수호신들이 모일때이다.  어서 수호파는 좋아요를 누르자.수호파가 얼마나 위대한지 보여주자.
결말 진짜 새드만 아니면..ㅜ지금 수호파가 많아서 수호랑 이여지면 좀 막장이고서준이랑 계속 가는것도 별로라하고제발 해피해피해피로
다음화에 뭔가 터질거 같은데.. 너무 평화로워서 불길하다 
전선욱작가님이랑 사귀시는거 맞나보네요~인스타로 꽁냥꽁냥 가끔 데이트도하구~ 프리드로우 그림도 올리는걸보니~
작가님 전 작가님이 생각하신 스토리대로 그냥 계속 가면좋겠습니다수호파 서준파 이런거 상관 쓰지 말고 생각하신 스토리 그대로 가주셨으면 좋겠습니다.
서준이가주경이 겁나좋아한거인정함근데 수호가더많이좋아함
작가님 악플 말고 선플만 기억해주세여응원하는사람이 더 많아여!! 화이팅
이편 보니까 정주행 하고싶어졌다ㅋㅋㅋ
이정도면 옆동네 이경우수준 ㅋㅋㅋ 전개랑 인물구도가 다똑같네 서준이는 학창시절때 경우랑 똑같은 코스쥬?
여기서 수호 응원하는 사람들도 이상함수호가 한국에 다시 오게됨으로써 서준이와 주경이의 연애가 엉망이 되어가고 수호는 남친있는애하고 밥먹고 드라이브하고특히 수호는 남친있는 주경이를 아직도 잊지못했으면서 서준이를 응원하는척하고수호도 정상은 아님위선적이지
수호 선넘지마라 주경이 남친있다 일본에서 주경이 연락도 씹고 왜 지금 좋아하냐
그저 그림빨로 스토리도 진전없는 유치찬란 클리셰 범벅인 웹툰. 인스타 가보니 여왕벌 놀이에 정신이 없드만.몸매 노출 사진 즐기던데 노출증이 심한듯. 관종끼도 있어보이는데 그럴 시간에 스토리 공부나 하시길.
나만 요즘 재미없음?
"수호파 특징 연애경험 없음소설, 드라마, 웹툰 등으로 상상의 나래 풍부 작가지망생 추천"
서준이 연예계 활동하다가 왠지 과거 논란 될 것 같기도 하네
ㅇㄴ; 세연이가 왜 수호땜에 죽음
내용은 있네....근데 서준이가 예전에 이랬다는 떡밥 하나도 없지 않았나..?
날 망가뜨리고 싶었ㄷr.....☆ 존나 ㅋㅋㅋㅋㅋㅋㅋㅋ인소 말투 씹오지네 
아이고 서준이 저때 힘들고 상황이 안타까운건 맞지만 나중에 연예계 생활하다보면 한번은 저일로 제대로 터지겠네
저때부터 서준이가 주경이 관심 있엇네
서준아 미안한데 수호야 존나 사랑해
지금 이스토리에서는 뭘해도 이상할듯서준이랑 계속 사귀는 스토리면 2기때 수호 넣을 필요가 없었고 수호랑 사귀면 서준이랑 잘 지내고 있는데 갑자기 무슨일 생겨서 수호랑 사귀는것도 이상할것 같음...
서준쓰 난 남주 상관없이니 연옌으로 성공했으면 좋겠는데ㅜ행동좀 조심하고 다니지😢
서준이도 이 작품에서 비중 큰 캐릭터인데 그냥 보자 좀...  
근데 왜 수호땜에 죽었다함..
작가님 갑자기 뜬금없이 학생때로 돌아온지는 모르겠는데 그 속에 떡밥이나 내용이 있겠죠?ㅜㅜ 작가님이 설정하신 내용 기대 하면서 쿠키결제 합니다아..
아니 솔직히 이거 내용 전개가..너무 이상해요 ㅠㅠ서바이벌하고 갑자기 수호랑주경이랑 드라이브 갔다가 서준이가 5년뒤엔 다이어몬드 사줘야지 하고 갑자기 고등학교 회상씬..?그래서 하고싶은 이야기가 뭔거죠 서준이는 안쓰럽고 불쌍한 서브 남주에다가 사연이 많아 어쩔 수 없이 주경이가 수호에게 가게 하는 그런 모습을 보여줄려고 갑자기 과거씬을 삽입한건가요? 읽을수록 바보되는 느낌..더이상 볼 이유가 없네요. 결말도 뻔한 것 같고..어떻게 이야기를 풀어가실지 참 궁금했는데 수고하세요.
주경이랑 서준이 학생때 친해진거 좀 뜬금없다 생각했는데 이런일이 있었으면 서준이 도와준걸로 주경이를 알게되고 관심갖게되서 자연스럽게 좋아졌던거같고시즌1때 말그대로 첫사랑수호 에 관련된 에피소드였다면 지금은 첫남자친구인 서준이에 관련된 에피소드니까이상하지않은데..?떡밥이랑 무슨상관이지
주경이랑 서준이 전에도 한번 만났옸네
보기 싫으면 꺼져~ 이딴 논리는 대체 어디서 만들어진거야??솔직히 욕먹을만 했자너 요즘 내용도 없고 갑자기 과거 회상을 하지 않나서준이는 왜 수호때매 죽었다고 생각하는거 그리고 존나 의문인가수호랑 서준이중에 누가 남주인가요 작가님? 서준이랑 사귀게 해놓고자꾸 수호랑 이어주려고 하는게 보여요 차라리 서준이랑 엮지를 말던가저는 어디파도 아니라서 누가 되던 상관 없는데 누구랑 엮지도 누구랑 이을지도 이도저도 못한 상황까지 만들어서 스토리 진행 하는건아니라고 봐요 그리고 초반에는 스토리도 탄탄하고 전개도 깔끔했는데요즘엔 갈팡질팡 하고 갑자기 나오지도 않아도 될 사람들도 나오고한회에 담을수 있는 스토리도 몇회에 걸쳐서 풀고 솔직히 말하자면초심 잃은거 같애요 진짜 이런 부분에서는 고쳐 줬으면 합니다
여신강림 진짜 표절같음술 마시게하고 여자 불러서 소문내는거 자판귀랑 똑같고 프로그램 이름도 프린스 오브 프린스인데 화장지워주는 남자에 신데렐라 오브 페이스 이거 베낀거같고 이번화 서준이가 어머니 무릎 꿇는거 보는 씬 연애혁명 이경우가 임정훈 때려서 어머니 무릎꿇고 경우가 저 자세 저 표정 저 각도 그디로 있었음. 이거 3개다 여신강림이 표절한 것 같음.이거 좀 올려줘
왜캐 재미없냐
진짜 진지하게 이웹툰 주제랑 장르가 뭐임? 로맨스라기엔 별로 설레거나 꽁냥대는 것도 없고 성장물이라기엔 주인공 오히려 퇴화한 듯 싶고 스릴러도 아니고 공포물도 아니고 일상물이라기엔 공감 1도 안되고 별로 일상적이지도 않고 판타지도 아니고 주인공이 친구가 없으니 우정물도 아니고 개그나 코미디도 아니잖아 장르가 뭐야 대체...?? 주제도 없어 뭐 '예뻐져서 잘생긴 남자 만나자' 이런건 아닐 거 아냐ㅋㅋㅋ 교훈도 없고 감동도 없어 엑스트라들은 다 똑같이 생겼고 꼭 착한놈은 잘생기고 못된놈은 못생기고ㅋㅋㅋㅋ 너무 1차원적이고... 외모지상주의 장려 만화야 뭐야ㅋㅋㅋㅋㅋㅋㅋㅋ 스토리도 뻔하디 뻔하고 진부하고 어색하고... 등장인물들도 입체감도 없고 억지스럽고 성격도 다들 이상하고... 전개도 무슨 90년대 인소랑 맞먹을 정도...ㅋㅋㅋㅋㅋ 1등감아 아닌데 아직까지 1등인거보면 신기하다...
예전부터 쿠키구워오던 사람인데 프린스 콘테스트인가 그거 할때부터 쿠키도 안굽고 만화도 안본지 좀 됐네요 이야기가 자꾸 다른데로 새는거같아요
도대체 만화 내용이 뭔지 모르겠다...
내용 너무없는디...
진짜...솔직하게 말해서 그림은 예쁜데 내용이 너무 별로에요... 이 댓글 보면 또 '그럼 보지마!' 이러겠지??그게 아니고 충고라고... 이런식으로 웹툰 그리면 결국 나중에 사람들이 다 비난한다고...
작가님 이번엔 스토리가 좀 개연성 없는건 맞는것같아요 저번화에 주경이랑 수호 드라이브 하지않았나 근데 갑자기 과거회상...?
죄송한데 재미없어요
음...내 200원이 사라졌어요....
     ∧ ∧　 (´･ω･)  =3　 /　 ⌒ヽ　(人＿＿つ_つ써준.. 미안한데 나는 이번 화를 보고 수호가 더 확실해졌어.. 수호파 모여..!!
요즘 웹툰들 갈수록 산으로 가는게 유행인가.......?
처음 댓글 달아요. 정말 왠만해선 부정적인 댓글 안달려고 하는데 정만 이번 편은 아닌것 같에요. 매번 이야기는 개연성도 떨어지고 그림만 이뻤지 매번 지지부진하게 구멍 펑펑 뚫려있는 느낌. 질질 끄는거 너무 재미없네요. 스토리도 엉망이구. 이제 여신강림 안보렵니다. 안녕 ... 작가님 댓글들 보고 좀 깨닫는게 있음 좋겠네요. 
내용이 없는건 사실이지만 인내심을 갖고 기다려봅시다... 작가님의 빅픽처가 있겠죠.....
아...아니... 좀 심했다 ..작가님 이건 좀 아니지..
서준이 대스타 되고나서 과거 털리는 거(학폭같은) 개연성 만들어 주려고 그런가보네요 ㅠㅠ 아 그래도 뜬금없이 과거로 갔습니다 ㅠㅠ 다소 아쉽지만 기다릴게요 ㅠㅠ 
죽은사람 건드는건 아니다
웹툰 내용 상 서준이는 곧 데뷔를 할 것 같고 어쩔 수 없이 주경이랑은 헤어지게 되어있음 수호랑 이어질지 어떻게 될 지는 모르겠지만 작가님이 수호의 해외 얘기를 주경이와 많이 연관시킨 것만 봐도 수호랑 주경이는 이어지는구나라고 알 수 있음 근데 그 중간 과정이 너무 궁금하네요 작가님...
똥 싸다가 끊긴 느낌이네...
여신강림 망해가나?ㅋㅋㅈㄴ 정떨어지네
이 웹툰 왜 1위이죠? 알려주세요ㅠ 뭐 땜에 1위인지 전 모르겠는데..ㅠㅜ
"작가님....정말 존경했습니다...한명의 독자로서,한명의 미술전공자로서,한 명의 웹툰작가희망자로서요.제가 마침 휴재 끝나셨을 때부터 보게 됬습니다.제 첫 웹툰이었어요.솔직히 내용이 없고,배댓들이 스토리 지적할 때마다 어느정도 동감간 건 사실입니다.그렇지만 저는 작가님을 믿었습니다. 큰그림을 위한 기다림일 것이라고...댓들도 수호파니 서준파니 지쳐갈때도 기다렸습니다..작가님,그림체....안 이뻐도 됩니다...웹툰이 그림체가 몹시 중요한 요소긴 하지만 저는 작가님께서 그림체 뿐만이 아니라 스토리로도 칭찬받는 분이 되시길 바랍니다.계속 믿고 계속 볼테니 부탁드립니다..스토리로 칭찬받는 작가님이 되어주세요...작가님..."
왜 이 웹툰이 1위인지 아직도 모르겠어
"❤️❤️❤️❤️제발 올려주세요❤️❤️❤️❤️이 웹툰은 일본 만화 '스위치걸' 모작입니다초반 비교해 보시면 설정, 내용이 같은 건 기본이고 여주의 쌩얼은 그냥 복붙수준입니다.초반에 모작으로 인기 좀 끌었다가 유명세 타고 스스로 스토리 풀어나가려니 작품이 망가지는 건 당연합니다다른 작품들은 조금만 그림체 비슷해도 모작소리 들으며 바로 컷 당했는데이 작품은 그냥 번역판 수준인데 어떻게 아직까지 남아있는지 모르겠네요"
아니 주경이 진짜 뭔데 남친있으면서 남사친이랑 추억 이러고 스포츠카 타고 다니고 수호 서준 좋은데 주경이가 좀 노답인듯 
자기는 불안해하면서 정작 서준이가 제일 불안해하는애랑 만나고있네 ㅋㅋㅋㅋ
수호파인 이유가 있다고... 광대야 정신차려 니얘기아냐
에이든 1등인 거 광고로 알겠는데 왜 베댓이 다 1등 묻기지
서준이랑 일때문에 헤어지고 수호가 위로하면서 수호랑 이뤄질듯..
자기가 주고 싶어서 밴드를 바꿔놓은게 아니라 밴드랑 약을 가지고 대기실을 가니 누가 이미 두고 간 상태라 아쉬워하며 발걸음을 돌린 겁니다.
1등이 화장품모델한다고했으니까 에이든이 1등이네요
1. 에이든 (광고 모델 나옴)2. 한서준 (말로 언급)3. 이수호 (괜히 했다고 말하는 거 보니까 3등 맞는 듯)대충 추측하면 이렇게 아님?
입장바꿔서 내 남친이 허구헌날 첫사랑만나면서 스트레스 풀고 웃고 떠들면 진짜 참 쿨하게 넘어가지겠다. 주경이 진짜 이상함. 현실에서 저런애 안보고싶다
주경이 너무 흘리고다님. 어장관리지 저게뭔짓이여
아니 근데 주경이랑 수호랑 예전부터 친하다해도 남친이 싫어하는데 저리 같이 노는게 맞나??? 반대로 생각하면 니들 남친이 여사친이랑 저리 드라이브하면서 노는거임
밴드 저번에 그 메이크업 같이 하는 친구가 줬다고 그랬는데...다 제대로 안보셨남...
환승하는거 합리화하려고 스토리 질질 끌면서 용쓴다 용써 아무리 그래도 구질구질한 환승될듯
수호에게 어울리는 정말 괜찮은 여친이 등장하면 좋겠다...수호가 너무너무 아까워요 ㅠㅠ
온전히 주경이는 모든 것을 긍정적이게 생각하고 추억이라고 말하는 걸 보고 수호도 긍정적이게 추억이라고 마음에 품어두는겸 주경이랑 예전에 있던 그 기억들도 그냥 단지 지나간 행복한 추억이라고 남겨두고 온전히 지금은 주경이의 행복을 바라는 것 같다 서준이가 연예인이 되고 나서 사이가 어떻게 바뀔지는 모르겠지만 아직까지는 수호와 주경이의 가능성은 잘 안 보이네요ㅠㅠ 수호파인데ㅠㅠ
작가님 솔직히 스토리 전개 너무 식상해요.. 초딩들이 로맨스 만화 그리면 스토리 전개가 딱 이거일것같아요... 남친있는데 남친 잘되니까 뭔가 평범한 연애를 원했는데... 이러면서 남사친에게 눈돌리고 남사친이랑 이루어지는 그런 스토리... 솔직히 작가님 매주 고생하시고 열심히 하신다는거 알아요! 하지만 작가님은 프로시잖아요 작가시잖아요 이걸로 돈버시는 거잖아요 직업인 사람에개는 단지 열심히란게 통하지 않아요 잘하니까 이걸로 돈버는 거니까 그리고 독자들이 스토리전개 발전을 원하면 독자분들의 피드백을 받아들이셔야 한다고 생각합니다  상식적으로 남친이 있는데 남친이 불편해하는 남사친이랑 밤에 스포츠카 타고 다니는거 이상해요... 서준이랑 해어지고 수호랑 이뤄지게 하시려면 서준이가 유명인이 되서 점점 본인이 생각한 연애랑 달라서 수호로 갈아타는 전개가 아니라 서준이와의 갈등이후 주경이의 연애에 공백기간이 있고 그 공백동안 주경이가 발전을 하고 수호랑 차차 이뤄지는게 더 나을것같아요!!!!
진짜로 여주 개노답이다...작가가 여주 안티인듯 지는 불안해하면서 남자친구 신경 1도 안쓰고 남사친이랑 단둘이 놀러다니기ㅋㅋㅋㅋㅋㅋㅋㅋ반대로 서준이가 그랬다면? 바로 헤어졌겠지ㅋㅋㅋ어떻게든 수호랑 다시 이어줄려고 구구절절 이상한 내용 끼어넣네..작가양반 이렇게 수호랑 된다쳐도 그럼 수호랑 서준이 우정은 어떻게 되는거임? 동물의 왕국이라 상관없나..? 진짜 여캐 최악 중에 최악이다..여지 다 줘놓고선 맨날 눈치도 없고 자기만 불쌍하고 힘들고 불안한척..남친에 대한 배려가 1도 없네
저건 주경이가 노답인데..남친 있는 애가 ..남사친이랑 ..심지어 첫사랑이랑 저러고 다니는데..저게 어장관리가 아니면 뭔데..
주경이가 제일 노답이다
이수호나 임주경이나ㅋㅋㅋㅋ 남친있는애한테 꼬리치는 놈이나 그걸또 좋다고 받아먹는 년이나 
우기 여전히 센스쟁이구나 좋은 남자 만나야 해 
우리의 첫 남주... 반갑다야
그래서 우기가 좋아하는 애가 대체 누군데??? 윰세 7대 미스테리 중 하나다
순간 바비인줄 알고 깜짝 놀랐네
와 오랜만이다 이얼굴 다시보니까 이집 성형맛집이네
헐 대박이다 이렇게  엄마아빠 닮은 점을 표현한건가
완결 안돼요... 수백명의 독자들이 허락하지 않습니다
아 ㅠㅠ 이렇게 표현하는거 너무 귀여워요 현실은 과정이 엄청나지만
그리고 이들은 원수사이가 됐다고...
니 앞에 있는 놈..
아 유미 어머님이구나 유미가 어머니 닯았네
우리 딸 넘 예쁘다 ㅠㅠ
역시 이성이가 감성이 말리규잇넼ㅋㅋㅋㅋㅋㅋㅋ
그새끼는피부가하얗지않아
아까는 누가 봐도 썸이였는데 지금은 쌈이넼ㅋㅋㄱ
우리 루비 어딨어!! 끼르요힝 
왜 싫은데 ㅅㅂㅋㄱㅋㄱㅋㄱㅋㅋㅋㅋㅋ
"뭐야  작가님   완결각  하지마요   바비 나온다고  화 안낼게요  쿠키도  많이 쓸게요.. 웅이  못생겨졌다고  승질  안낼게요유미 순록이  아직 1년도  안본거 같은데 ,, 읭..? 제발영 ㅜㅜ"
화내고있는 세포 너 히스테리우스지
황여심은 유미의 어머니입니다
"우리 유미,,, 쿠키로 낳은 내 딸... 이렇게 쉽게 못 보낸다... 순록아 평생 우리 유미한테 잘해줘... ㅠㅠㅠㅠㅠㅠㅠㅠㅠㅠㅠㅠ 잘살아라 우리 딸 ㅠㅠㅠㅠㅠㅠㅠ"
진짜 역대급으로 설레는 장면 중 하나인 것 같아요. 그 동안 유미가 만나온 사람들이 각각의 매력이 있었지만(아닌 사람도 있지만) 결국 순록이를 만나기 위해 조금씩 맞지 않는 사람들을 만나왔던 것 같네요. 너무 예쁜 그림입니다.
제목 모스부호인가 오류난줄알았네
앞으로 연재계획503화 결혼식557화 육아일기2002화 아들대학5798화 회춘9438화 사망9439화 예토전생9440화 RE:유미의 세포들
개웃기다 ㅋㄱㅋㄱㄲㄱㄱㄱㄱㅋ 안불렀다 
와.. 무빙건 대다나다. 응큼한 분위기에서 감동폭발로 급 전개 바뀌는가보소. 
ㅋㅋㅋㅋㅋㅋㅋㅋㅋㅋㅋㅋㅋㅋㅋㅋㅋㅋㅋㅋㅋㅋㅋㅋㅋㅋㅋㅋㅋㅋㅋㅋㅋㅋㅋㅋㅋㅋㅋㅋㅋㅋㅋㅋㅋㅋㅋㅋㅋ세포주제에 캡슐타고오네
이제 제목 뜻을 알았습니다 ㄱㅇㅁ 정답은 근육미 였습니다
이거보는 떨리는것은 정상입니다
예토전생ㅋㅋㅋㅋㅋㅋ쿠키로 낳은 딸ㅋㅋㅋㅋㅋㅋ나도 네애미다ㅋㅋㅋㅋㅋ항상 행복해라 
음....응큼세포가 로켓을 타고 와서 우뚝 서있네요아니 뭐 그냥 그렇다고요
따따따 따따라따따 물보라를 일으켜
꺼지지마 당장 돌아와 
그런 거?ㅋㅋㅋㅋ
이거 폰 배경화면용 없나요ㅠㅜ
욕 하는 거 목소리 개섹시하다
발열 증상이 의심된다면 1399혹은 가까운 보건소에서 검사받으세요
ㅋㅋㄱㅋㄱㅋ 이게 뭐라고 왤케 비장해 ㅋㅋㅋㅋ
직장인이 복근이라니 홈트 빡세게 했구나 순록아...
또 물보라를 일으켜 따 따 따 따 따따따 따 따 따  𓂃𓂃𓂃𓂃𓂃𓂃𓊝𓄹𓄺𓂃𓂃𓂃𓂃𓂃 𓆝𓆟𓆜𓆞𓆡𓆝𓆟𓆜𓆞𓆡𓆝𓆟 𓆟𓆜𓆞𓆡𓆝𓆟꧁⍤⃝꧂ 𓆟𓆜 𓆞𓆡𓆝𓆟𓆜𓆞𓆡𓆝𓆟𓆜𓆞𓆡 
드디어 제 닉을 쓸차례인가요
유미 남편이 순록이라 너무 좋긴한데....왠지 완결각 잡힌것 같아서 슬픈건 나뿐이야?ㅠㅠㅠㅠㅠㅠ
눈물난다......
동건끼 저에요 문열어주실 필요 없어요 꽃다발 문 앞에 두고 갈게요 정말 사랑합니다 감사합니다 ...
와 미래에서 보내는 시그널이야 이거ㅠㅠㅠ???
이제 무빙건이 해야 할 일들원고 따라한 걔 조지기다은바비 부부 조지기
내 딸도 아닌데 눈물난다 
아..진짜눈물날것같아 내자식 결혼보내는 기분이야유미야.. 순록아.. 행복해
이제 발 뻗고 표절작가 조질 날만 기다립니다 ㅋㅋㅋㅋ
너무 이뻐....
미래였어ㅠㅠ 미래야미래 결혼하는 시그널 보낸거잖아ㅠ
